,activeTime,companyFullName,companySize,createTime,district,jobDetail,pageUrl,positionLat,positionLng,positionName,salary,skillLables,stationname,workAddr,workYear
225,晚上9点最活跃,上海非夕机器人科技有限公司,150-500人,2019-10-23 12:02:20,南山区,"职位描述：                工作职责1、负责公司内部多个部门优化工具的前端web后端业务逻辑层、数据层的设计，开发，优化；2、负责应用的架构设计、功能实现并进行测试部署；3、与后端开发团队紧密合作，确保代码能有效对接，并优化性能。4、严格遵守团队的代码格式，编写易读、高质量、高效率的代码。   任职要求  1、本科以上学历，计算机相关专业，2年以上Django开发工作经验；2、熟练掌握Python语言，常用Python类库；3、熟悉常用的数据库和缓存组件，包括但不限于Mysql、Redis、Mongo等；4、熟悉Django/Flask等Web框架, 了解Web开发相关知识，如HTML, Css, JavaScript；5、熟悉Linux开发和部署环境，熟练使用常用Linux命令4、具有较强的分析和解决问题的能力、动手能力和应变能力，良好的沟通能力；优先录用条件：有前端开发经验者优先",https://www.lagou.com/jobs/6528429.html,22.541052,113.951368,Django开发工程师,10k-20k,['Python'],高新园,深圳-南山区-大冲-大冲商务中心A座,1-3年
226,下午4点最活跃,深圳岚锋创视网络科技有限公司,150-500人,2019-10-21 14:09:46,宝安区,职位描述：                工作内容1. 负责接口模块相关系统开发、升级和维护2. 为技术决策提供平衡各类的不同观点3. 支持业务需求，深度参与业务系统的设计与实施4. 与项目开发相关人员进行有效沟通，化解技术风险，提供有前瞻性的技术解决方案，确保按计划完成开发任务 任职要求1. 计算机相关专业，本科及以上学历2. 掌握JAVA语言，有JVM调优经验是加分项；3. 了解SQL开发，至少熟悉Oracle/Mysql，了解Linux基本命令,https://www.lagou.com/jobs/6367247.html,22.548552,113.887095,校招-后端工程师,10k-15k,['后端'],翻身,深圳-宝安区-新安-深圳市宝安区海秀路龙光世纪大厦A座6层,应届毕业生
227,早9点最活跃,弘量科技（深圳）有限公司,50-150人,2019-10-25 09:41:07,南山区,职位描述：                工作职责： 1. 参与设计与开发公司后端系统（交易，行情，产品等） 2. 撰写系统相关文档 3. 维护现有线上系统 任职资格: 计算机或相关专业，全日制本科及其以上学历; 2. 热爱编程，基础知识扎实，熟悉基础数据结构、常用算法；对挑战技术难题充满兴趣和激情； 3. 熟悉C/C++/Java/Python之一; 4. 踏实肯干、善于学习、积极主动、认真负责、团队协作能力强;公司提供有竞争力的工资+奖金+股权激励，正规的五险一金、休假等福利，额外有各种小福利。公司团队来自腾讯、华为等知名企业。产品线有：1、资管业务，由公司Algo团队支持，提供给公募私募策略2、2B2C业务，公司给大型金融机构提供算法+IT的完整解决方案3、2C业务，在香港和内地均有财富管理产品推出目前和多家知名VC在洽谈融资，发展前景良好。,https://www.lagou.com/jobs/5279150.html,22.541617,113.952906,后端工程师,8k-11k,"['C', 'C++', 'Java', 'Python']",高新园,深圳-南山区-华润置地大厦D座1107-1109,应届毕业生
228,下午5点最活跃,北京国双科技有限公司,500-2000人,2019-10-24 15:55:36,福田区,职位描述：                岗位职责：1、参与公司软件产品的代码编写工作；                                    2.参与软件研发过程中的文档撰写。任职资格：1、 计算机或相关理工科专业背景优先；2、 独立负责过一个软件项目的全栈开发及维护经验，具备一定的产品思维；3、 熟练掌握C/C++/Python/C#/Java等一门主流后端编程语言，有WEB编程经验者优先；4、 数据结构与算法基础扎实，具备良好的编码习惯；5、 逻辑思维较强，喜欢探寻技术原理和问题本质，效率工具控；6、 责任心较强，做事细致耐心，具有良好的团队协作能力。,https://www.lagou.com/jobs/6393604.html,22.543462,114.068588,后端研发工程师,10k-15k,['后端'],岗厦,深圳-福田区-莲花二村-彩田路东侧橄榄大厦,应届毕业生
229,下午2点最活跃,昌都市万盛建设工程有限公司,500-2000人,2019-10-18 15:10:54,福田区,"职位描述：                岗位职责·         参与系统的需求调研和需求分析；·         搭建系统开发环境，完成系统框架和核心代码的实现；·         负责 Java 性能分析软件的开发；·         系统开发测试、部署和集成；·         负责解决开发过程中的技术问题；·         参与代码维护与备份。任职要求·         5 年以上的 java/C#/C++/Ruby/Python 等语言开发经验；·         熟悉语言特性, 了解其优缺点；·         熟悉常用框架, 包括 Web 框架, 数据库框架, 依赖管理, 测试框架·         有良好的编程风格，能够书写规范、优质的代码；·         良好的团队协作能力;如果你还具备以下技能那就更好了·         喜欢阅读源代码；·         热爱阅读各类技术、非技术书籍；·         喜欢学习，拥有持续学习的能力，认为学习本身就是一种乐趣; 4. 喜欢开源软件，乐于知识分享；·         拥有自我管理能力，自我驱动，做自己的老板。",https://www.lagou.com/jobs/5821677.html,22.57625,113.862983,后端开发工程师,20k-40k,"['Java', 'Python', '分布式', '后端']",西乡,深圳-福田区-西乡街道新湖路汇一城A座2116,不限
230,早11点最活跃,苏州博纳讯动软件有限公司,150-500人,2019-10-15 17:59:24,福田区,职位描述：                工作职责：1、搭建、集成、维护CICD工具链及度量平台、Portal平台2、培训接入项目团队使用工具，编写使用手册及FAQ文档，解答使用过程中的问题3、工具流程方案实施4、工具链额外需求开发任职要求：1、大专及以上学历，计算机或者相关专业；2、了解CI、CD，了解持续集成工具链上的各种开源工具3、熟练掌握Java语言，至少熟悉 python/ruby/shell中任意一种脚本语言4、熟悉持续集成中的重点工具（CI工具、版本控制工具、质量检查工具）优先5、熟练使用Apache Ant、Maven 、Selenium、JUnit、JMeter、Gradle等自动化构建和测试工具优先6、熟悉docker、k8s等技术优先7、良好的学习能力，有责任感和良好的团队合作精神,https://www.lagou.com/jobs/6482551.html,22.54207,114.063497,后端研发工程师,13k-25k,"['后端', '中间件', 'Java', 'docker']",岗厦,深圳-福田区-金田路安联大厦,不限
231,早11点最活跃,苏州博纳讯动软件有限公司,150-500人,2019-10-14 16:27:46,福田区,职位描述：                 掌握Spring/Spring Boot技术栈， 有 SpringCloud 服务治理组件的集成经验， 熟悉Apollo、SkyWalking、Promethues、Nginx等中间件的原理和使用， 熟悉K8s架构以其集成经验优先 中高级Java开发,https://www.lagou.com/jobs/6494981.html,22.54207,114.063497,后端开发工程师,14k-24k,"['后端', '中间件', 'Java']",岗厦,深圳-福田区-金田路安联大厦,不限
232,晚上10点最活跃,魔比卡拉科贸有限公司,少于15人,2019-10-13 14:53:14,南山区,职位描述：                职位描述：【工作内容】1、广告系统后台服务工程设计、开发与优化2、协调算法人力，优化广告投放效果，为公司创造更多价值【任职要求】1、计算机基础扎实，有较好的的数据结构及算法功底，有良好的编程习惯和编码规范；2、至少熟练使用一门编程语言(PHP/Python等)，具备快速学习能力，PHP有Yii框架或实际项目开发经验者优先；3、有良好的数据分析能力者优先；4、有大规模、高并发、分布式系统设计和开发经验者优先；5、有一线互联网广告行业经验者优先，6、有良好的沟通表达能力，热爱编程，有良好的逻辑思维抽象能力和较强的学习能力，有强烈的求知欲、好奇心和进取心 ，能及时关注和学习业界最新技术。,https://www.lagou.com/jobs/6115879.html,22.515229,113.903154,后端开发工程师,8k-16k,"['后端', '服务器端', 'Linux/Unix', 'Yii']",,深圳-南山区-前湾一路鲤鱼门街一号,1-3年
233,下午5点最活跃,深圳市叁亿广告有限公司,15-50人,2019-10-08 16:22:25,南山区,"职位描述：                1、 必须具备综合能力, 有强烈的上进心和求知欲，善于学习新事物2、 学历不限，计算机相关专业优先3、 有3年及以上以PHP或者JAVA为主的中型或大型互联网产品软件的开发及维护工作经验4、 熟悉MySQL数据库，拥有优秀的数据库设计能力，对数据库的基本理论及其内部实现机制有比较深刻的理解5、 熟悉Linux/Unix，在其上有丰富的开发经验6、 对服务器端程序的部署、架构、调优有一定的了解7、 有很强的发现问题、分析问题和解决问题的能力8、 善于沟通和逻辑表达，良好的团队合作精神和积极主动的沟通意识如果有以下经验，将优先考虑：（1）android开发经验； (2) 游戏SDK开发经验（3）分布式系统开发经验； (4) 多语言使用经验;",https://www.lagou.com/jobs/6469240.html,22.543597,113.937511,后端工程师,12k-18k,['后端'],深大,深圳-南山区-科技园-南山区粤海街道科技园劲嘉科技大厦1001,3-5年
234,下午3点最活跃,深圳无一科技有限公司,15-50人,2019-10-25 15:42:57,南山区,职位描述：                岗位职责：-参与相关服务器端系统的开发工作。-工作主要使用Python，完成如下工作：1.Django admin后台的开发2.Celery任务脚本的编写3.用于推荐系统的数据的整理和清洗职位要求：1. 计算机相关专业本科大二以上或研究生在校学生。2. 熟悉至少一种编程语言。3. 了解至少一种数据库的使用。4. 数据结构、离散数学课程成绩良好。5. 对编程拥有强烈的兴趣。6. 具有良好的表达能力和沟通能力。每周可全职工作两天以上。,https://www.lagou.com/jobs/6358984.html,22.528499,113.923552,后端开发实习生,3k-5k,"['后端', 'Python']",南山,深圳-南山区-科技园-中科大厦,应届毕业生
235,下午5点最活跃,风变科技（深圳）有限公司,150-500人,2019-10-23 20:33:29,南山区,职位描述：                【职位诱惑】小组制度、导师带教、多语言学习、新技术探索> 加入我们，你将学习承载百万学员的学习平台如何被创造；了解风变编程的微服务架构、集群化管理、DevOps文化；不仅仅会使用Go/Python/Java 多种语言，还有Docker、K8S、Elasticsearch、WebSocket等服务架构的演进，同时还会与其他Group 一起开展 NLP（自然语言处理）与 AI问答、PLT（Programming language theory）设计编程语言等领域的深入研究；> 作为一家教育公司的技术团队，秉承公司的教育理念，对待实习生的培养我们非常认真并且专业。期待你的快速成长，我们能一起探讨技术的未来。【能力要求】1. 计算机相关专业并且热爱计算机与coding。在校期间的每个实验或大作业都是自己独立完成，并成为了别人的大腿2. 逻辑能力强，看见一个产品就能很快分析出背后的实现逻辑3. 至少使用 Go || Java || Python  实现过一个 web 项目4. 除了 MySQL 、SQL Server 外，至少还用过1种其他数据库，比如 PostgreSQL、Mongo DB5. 已经放弃使用 Windows ，选择了 Mac os 、Ubuntu 或其他 Linux 发行版作为你的开发环境6. 追求更高的代码质量，所以设计模式是比较熟悉的，并且应用在了自己做的一些项目里7. 非常熟悉 Git ，了解  Git-flow 或者 Gitlab-flow 8. 以上 7 点完全匹配可能要求较高，如果你真的热爱编程、乐于挑战也可以投简历试一试【职位描述】1. 前期，学习并熟悉公司的业务与技术架构2. 根据成长幅度的不同，参与不同难度的产品项目3. 能力突出者，参与新技术探索与应用4. 能力突出并不难，目前我们系统的部分核心业务与设计就是实习生参与共同完成的,https://www.lagou.com/jobs/6299136.html,22.546157,113.946882,后端开发实习生,3k-5k,"['Golang', 'Python', 'Java', '后端']",高新园,深圳-南山区-讯美科技广场1号楼,应届毕业生
236,下午3点最活跃,深圳市大成天下信息技术有限公司,15-50人,2019-10-23 16:09:28,南山区,职位描述：                ## 职位描述主要从事知识星球产品的 API 等后端组件的研发工作。## 坐标深圳南山科技园。##你将面临的技术挑战有（包括但不局限于）：1. 复杂业务的敏捷迭代、结构设计、软件工程实践。2. 高并发业务场景下的：1. MySQL、Redis 等数据存储系统的应用设计与性能调优。2. Kafka、ELK 的应用与调优。3. 自动化集成与运维，如 Docker（以及未来 K8S）的应用与维护。## 要求1. 精通 PHP，熟悉至少一种 MVC 框架（如 Phalcon 等）。2. 熟悉 Linux、MySQL、Redis、Nginx、Git。3. 具有 MySQL 索引优化、查询优化、存储优化的经验。4. 具有 Redis 存储设计、查询优化的经验。5. 熟悉 PHP 的缓存技术、静态化设计。6. 熟练阅读英文技术文档。7. 3 年或以上后端研发经验。8. 优先考虑：    1. CET-4 425 分及以上。    2. 熟悉 Swoole / Kafka / ELK。    3. 熟悉 Lua。    4. 熟练使用 Docker。    5. 熟悉 Golang、Python。    6. 熟悉 JavaScript、jQuery、CSS3 等前端技术。,https://www.lagou.com/jobs/5859643.html,22.528953,113.945036,高级后端研发工程师,15k-30k,"['后端', 'PHP', 'Linux/Unix', 'Phalcon']",后海,深圳-南山区-科技园-高新南区中国地质大学产学研基地,3-5年
237,早11点最活跃,深圳市前海不丢不丢就不丢科技有限公司,15-50人,2019-10-23 11:51:22,南山区,职位描述：                公司简介室内设计师资源库业务--设计群岛：www.idsome.com 公司收购流程进行中，收购方-LSDCASA，国内**设计公司之一。新项目开启，新项目为社交电商方向，主营家具饰品等产品。技术团队持续招聘中。岗位职责负责公司产品的开发及改进，新项目的研发。参与系统的需求分析、编码等工作；确保相关系统安全稳定可靠运行。根据项目运营的需求，开发新的功能模块；及时了解、掌握新技术，负责优化网站资源。任职要求能够较快理解业务需求，学习能力出色，具备较好的逻辑思维能力基础扎实，熟练使用流行的php开发框架熟悉Mysql 数据库开发及优化了解Go语言优先了解前端技术者优先有相关经验者优先,https://www.lagou.com/jobs/6478084.html,22.547188,113.987304,初中级后端工程师-PHP,9k-10k,"['PHP', 'GO', 'Golang', '全栈']",侨城北,深圳-南山区-香年广场中建南方大厦,1-3年
238,下午5点最活跃,中国平安财产保险股份有限公司,2000人以上,2019-10-27 00:00:07,福田区,职位描述：                岗位职责：1、参与公司APP的后端设计与开发工作，包括需求分析、系统设计、编码和单元测试等工作；2、能够独立完成业务设计和相关技术实现；3、为团队引入创新的技术、创新的解决方案，用创新的思路解决实际问题。岗位要求：1、三年以上的JAVA系统开发经验，对项目中接触过的开源框架、技术产品、算法等有针对性的进行过深入学习，了解其底层机制和原理；2、对技术富有热情，能关注JAVA或互联网行业技术发展趋势，勇于尝试、敢于推动；3、良好的沟通能力，勇于担当，能和团队形成合力；4、有分布式、高并发、高负载、高可用系统设计、开发和调优经验者优先；5、有实际爬虫系统设计和实现能力者优先；6、熟悉Spring Cloud技术体系者优先。,https://www.lagou.com/jobs/4218036.html,22.533344,114.055755,java开发工程师,14k-28k,"['Java', '爬虫']",岗厦,深圳-福田区-新洲-益田路平安金融中心,3-5年
239,下午6点最活跃,成都聚正房地产经纪有限公司,50-150人,2019-10-08 18:42:43,南山区,职位描述：                岗位职责：1.负责设计和规划业务系统平台架构；2.主导业务平台架构搭建，制定各项研发规范，搭建基础研发环境，推动架构的演化和发展；3.主导技术方案和系统设计，把握复杂系统的设计，有能力解决性能、网络、分布式等引起的一系列技术问题；4.为团队引入创新的技术、创新的解决方案，用创新的思路解决问题；5.指导和培训技术人员，提升团队的技术分析、设计能力和系统架构能力；6.独立工作能力强，能够从零开始创建项目、搭建环境，并指导团队成员统一步调完成项目。岗位要求：1.计算机软件或相关专业，5年以上开发经验，2年以上团队技术主导者；2.有较复杂的业务系统的工作经验，高并发，高性能的网站经验；有大型互联网业务系统架构设计经验；3.Net或Java基础扎实，精通常用主流基础框架（框架提供的特性及其实现原理）；熟悉web系统的设计和部署，熟悉负载均衡、缓存、消息、搜索等机制，能对web系统的常用部署和运维技术进行合理应用，解决问题；4.熟悉Mysql、SqlServer等数据库，具有较强的数据库设计和优化能力；5.有较强的分析设计能力、方案整合能力和解决问题能力；6.知识面广，思路开阔，需要在一项技术上有很深入的了解；7.良好的团队合作精神，自我驱动，勤奋好学，关注互联网或应用开发的最新潮流，乐于尝试最新的技术，追求编写优雅的代码，从技术趋势和思路上能影响技术团队。,https://www.lagou.com/jobs/5953895.html,22.518973,113.943145,后端开发技术经理,25k-45k,"['后端', 'Java', 'Python', '全栈']",后海,深圳-南山区-深圳湾-卓越后海中心,5-10年
240,晚上8点最活跃,深圳市云科设计咨询服务有限公司,15-50人,2019-10-05 14:54:34,福田区,职位描述：                岗位职责：负责Web后端功能开发、数据处理和系统维护等。任职要求：- 熟悉Lua语言，有1年以上开发经验，或者其他语言3年以上开发经验。- 熟练掌握面向对象的程序设计。- 熟悉MVC架构，有类似架构网站开发经验者优先。- 熟悉MySQL等数据库基本操作。- 乐于学习新事物，善于团队协作。加分项：- 熟悉Linux开发环境，了解Openresty或Nginx服务器。- 了解Redis等NoSQL数据库。- 熟悉HTML5 / CSS3 / JS。,https://www.lagou.com/jobs/6381407.html,22.543645,114.095754,Lua后端工程师,10k-18k,['Linux/Unix'],红岭,深圳-福田区-振华路-上步路工会大厦,1-3年
241,早11点最活跃,深圳曲奇网络科技有限公司,少于15人,2019-10-25 11:41:14,宝安区,职位描述：                软星科技是一个充满活力，有趣的互联网创业团队团队成立于 2015年初，公司在深圳宝安（地铁1号线-固戍站附近）团队目前在开发并运营 [元气扭蛋] App欢迎应届生，暂不招实习【您过来主要做以下事情】 与团队紧密合作，编写稳定，可扩展，可测试的业务逻辑代码 设计API，并撰写技术/开发文档【任职要求】 计算机相关专业 本科以上学历【加分项】 颜值满分 熟练掌握 JavaScript / TypeScript 基于 egg.js 框架开发过完整线上项目 对 node.js 后端技术栈有一定了解 有自己的开源项目，技术博客，并常活跃在 github 【工作时间】 平日 9:30~6:30 (午休12:30~14:00) 周六 9:30~6:30 (大周上班小周休息) 平时不加班【薪资】 税后 10k + （试用2个月，期间薪资为80%） 社保（1档医疗，无公积金） 年终奖金（1～3月）【其他】 全员 MacBook Pro 每月固定 600 元补贴 周2网球，周4羽毛球 每年国内，国外团队旅游,https://www.lagou.com/jobs/6254060.html,22.598801,113.846459,node.js 后端开发,10k-15k,"['后端', '服务器端', 'Javascript', 'Node.js']",固戍,深圳-宝安区-西乡-固戍二路一方天地互联网基地（1号线固戍站F出口）,1-3年
242,早11点最活跃,达而观信息科技（上海）有限公司,150-500人,2019-10-25 13:39:23,南山区,职位描述：                职位描述：1、负责公司企业级应用产品对大型企业客户的开发、部署、技术交付工作（泛NLP、OCR、RPA、推荐、搜索、知识图谱、大数据系统等相关的产品和项目）；2、负责业务需求分析，将业务需求拆分成独立的业务功能，并负责相关的开发等工作；3、参与核心技术问题的攻关，架构设计，系统优化，协助解决项目开发过程中的技术难题；4、配合项目的整体计划和安排，对业务人员进行技术指导；岗位要求：1、计算机相关专业、本科及以上学历，3年以上后端开发经验，有项目负责人或leader经验者优先；2、熟悉Python后端开发，或C++基础扎实并有意向用python进行后端开发，工程代码能力优秀；3、熟悉SQL，熟悉Orcale、DB2、SQLSERVER、Mysql数据库应用开发中至少一个；4、熟悉linux/Unix常用操作命令，了解shell；5、具有高度的责任感，工作积极主动、学习能力强、善于总结，有规范化文档编写良好习惯；6、有过搜索类项目经验或熟悉elastic search优先；7、能够接受短期出差或驻场开发工作（华南区域，连续在外一般最长不超过2个月，短则2-3天）。,https://www.lagou.com/jobs/5099330.html,22.538149,113.951545,高级python开发工程师,20k-30k,"['后端', 'Python', '搜索', '信息检索']",高新园,深圳-南山区-大冲-深圳市南山区赋安科技大厦,5-10年
243,下午2点最活跃,深圳市爱思软件技术有限公司,50-150人,2019-10-24 09:37:19,南山区,职位描述：                岗位职责：1、开发和维护公司所有产品和服务的后端部分（包括但不限于客户端 API、网站及后台等）；2、利用 Node.js 和 Docker 等后端技术解决所有业务问题；3、对现有的系统和代码架构进行重构并不断优化，提高性能和可维护性；4、配合客户端工程师，完成代码有效对接。岗位要求：1、精通 Node.js，理解其技术架构、特性、适用场景，掌握至少一种服务端开发框架（例如 Koa、Express 等）；2、精通操作系统和网络通信原理，理解 HTTP/HTTPS 协议、文件系统、并发、分布式等概念；3、DevOps 自动化运维，熟练使用 Docker 及相关技术栈；4、数据驱动，至少掌握一到两门数据库技术（例如 MySQL、MongoDB、Redis 等），了解各种数据库的区别，理解数据层的设计和实现；5、了解公有云和私有云的区别，若有公有云的使用经验为更佳，例如 AWS、阿里云、腾讯云、Google Cloud 等（熟悉 AWS 者优先考虑）；6、对代码质量有高标准的自我要求，具有良好的代码书写习惯和重构能力，编程时头脑清晰，对前后端交互和接口的设计有一定的追求（有编写单元测试习惯者优先考虑）；7、具有扎实的编程功底和建模能力，精通常用的数据结构、算法、设计模式；8、能快速学习、有效沟通，有团队合作精神，对新技术或不熟悉的领域有探索精神；9、英文读写能力良好；10、其他优先考虑范围：有 Linux 环境下后端开发工作经验、有复杂应用开发和性能调优经验、有高可用/容灾相关工作经验、有前端开发经验或能力。,https://www.lagou.com/jobs/5865379.html,22.512389,113.940294,Node.js后端工程师,10k-20k,['后端'],后海,深圳-南山区-深圳湾-创业路1777号海信南方大厦3103,应届毕业生
244,下午5点最活跃,北京字节跳动科技有限公司,2000人以上,2019-10-26 22:01:34,南山区,职位描述：                职位职责：1、参与公司企业级产品后端的研发，确保系统的安全、高可用性和可靠性；2、参与业务需求讨论，评审产品设计，驱动研发团队一起按时、高质量完成产品交付；3、负责公司企业应用平台的开发和架构设计，保证设计和编码的质量，承担重点、难点的技术攻坚，主要开发语言为Java。职位要求：1、大三&研二学生优先；2、良好的设计和编码品味，热爱写代码；3、较好的产品意识，愿意将产品效果做为工作最重要的驱动因素；4、掌握WEB后端开发技术: 协议、架构、存储、缓存、安全等；5、积极乐观，认真负责，乐于协作。,https://www.lagou.com/jobs/6427846.html,22.511303,113.925766,后端开发实习生-EA,5k-10k,[],南山,深圳-南山区-南海大道2163号来福士广场15层,应届毕业生
