,activeTime,companyFullName,companySize,createTime,district,jobDetail,pageUrl,positionLat,positionLng,positionName,salary,skillLables,stationname,workAddr,workYear
114,下午3点最活跃,深圳市中联创新自控系统有限公司,150-500人,2019-10-25 17:18:34,福田区,职位描述：                我们是谁:中联创新旗下有速力思、迈斯、康耐德三个子品牌，在数据中心、社区与通用物联网领域拥有行业领先的技术积累与持续盈利的产品线。我们的研发毕业于CMU、清华、香港大学等国内外高校，来自谷歌、华为、百度等企业。主力研发方向为：1、面向创业公司的通用物联网硬件产品与平台；2、面向专业场景的工业领域AI+控制系统。岗位职责：1、负责工业物联网新产品线的研发工作，负责iot平台的整体架构设计；2、作为技术负责人，深入理解业务架构和需求，识别系统关键技术点，完成技术规划，输出技术文档并独立完成核心模块coding工作（没错，一定要能自己写代码)，并对团队代码做code review；3、组织团队定期技术交流，并理解其他技术团队的核心技术点。岗位要求：1、国内外TOP大学理工科背景；2、或者有国内网互联网大厂2年以上工作经验；3、熟悉Linux环境下开发；4、技术栈可以是:C++/Go，C++出身两者兼具最佳，深入学习理解过grpc，mongo，redis，influxdb，elk套件等开源组件；熟悉TCP、UDP等常见通讯协议，精通网络编程；5、在算法/大型架构上，有做出的成绩并有自己的理解，深入理解过优秀架构或算法库；有自己”造轮子“经历更优 。加分项：0、强烈的好奇心、对技术热爱；1、完整跑过机器学习任务并上线应用（不是用tensorflow跑过几个demo)；2、对开源社区有一定贡献；3、对主流技术框架源代码深入理解。欢迎对热爱技术、对自己技术成长有追求的小伙伴加入！,https://www.lagou.com/jobs/5976231.html,22.571976,114.060053,资深后端开发工程师（C++/GO）,40k-60k,"['后端', 'C++', 'GO', 'Linux/Unix']",梅村,深圳-福田区-中康路128号卓越城1期,5-10年
115,下午3点最活跃,深圳怡禾健康管理有限公司,50-150人,2019-10-25 13:44:19,福田区,职位描述：                岗位职责 负责怡禾健康线上业务需求分析，技术方案设计及开发 为怡禾健康公众号，小程序等前端应用提供API 任职资格 愿意使用Java进行开发。熟练掌握Java，C#，C/C++，Go等一种或几种后端开发语言 熟悉主流SQL，NoSQL数据库，至少对一种缓存技术有深入理解 有ElasticSearch开发经验优先 完整搭建过整个后端系统，有解决大规模并发请求经验、性能优化经验优先 有后端系统运维经验优先 有全栈开发经验优先,https://www.lagou.com/jobs/6144671.html,22.537394,114.02581,后端开发工程师,15k-30k,"['后端', '信息检索', 'Java']",农林,深圳-福田区-车公庙-万科富春东方大厦1406-1407,不限
116,下午3点最活跃,深圳晶泰科技有限公司,150-500人,2019-10-11 09:38:16,福田区,职位描述：                职位描述：1.负责晶体计算相关的业务的后端及中间件研发；2.包括但不限于云上计算框架的架构、实施、部署与运维工作；3.与业务分析团队紧密配合并设计技术解决方案；4.数据驱动，有较强的跨学科学习能力。职位要求：1. 熟练掌握至少一种编程语言，如Python、Golang、Node.js等；2. 熟练掌握数据结构、算法及模式设计，有良好的编码风格及代码版本管理习惯；3. 熟练掌握关系型数据库及NoSQL相关知识；4. 有AWS、腾讯云、华为云、阿里云等公有云的后端开发经验者优先。,https://www.lagou.com/jobs/5901477.html,22.537003,114.023823,后端开发工程师,10k-20k,"['后端', 'docker']",农林,深圳-福田区-车公庙-时代科技大厦东座,1-3年
117,下午2点最活跃,北京国双科技有限公司,500-2000人,2019-10-25 16:50:54,福田区,职位描述：                工作内容：  1、参与公司运维基础设施平台核心产品的研发；2、参与虚拟化基础设施、OpenStack、主流云平台等底层技术调研工作；3、撰写简洁易懂的概要技术设计文档。任职要求：1、大学本科及以上学历，计算机或相关理工科专业背景优先；2、3年以上Python/Java/.NET/Golang等其中一门语言的服务端研发经验，不拘泥于技术栈，编程基础扎实更重要；3、具有配置管理系统、监控告警系统、自动化运维平台、任务调度系统等开发经验者优先；4、熟悉KVM、Docker、Kubernetes、Ansible、Saltstack、PostgreSQL、ElasticSearch等若干技术者优先；5、对高效运维实践和运维开发工作有深刻理解；6、热爱编程，逻辑思维较强，能编写高质量代码，喜欢探寻技术原理和问题本质；7、工具控，喜欢折腾各种工具提升日常生活和工作效率；8、责任心较强，具有良好的自我驱动力和团队协作意识。职位挑战：- 一站式自动化管理并调度上千台服务器的资源和作业；- 海量运维日志和监控数据的高性能处理和智能化运维；- 报警风暴的智能化收敛和基于知识库的故障自愈。,https://www.lagou.com/jobs/6021713.html,22.543462,114.068588,高级后端开发工程师,15k-30k,"['Python', 'Java', 'docker', 'C#/.NET']",岗厦,深圳-福田区-岗厦-彩田路东侧橄榄大厦25层,3-5年
118,下午3点最活跃,珠海云迈网络科技有限公司,50-150人,2019-10-25 16:18:23,南山区,"职位描述：                职位描述：岗位职责 ：1、负责软件设计、核心重要模块开发，有很强的质量意识，主导核心代码开发；2、根据项目具体要求，承担开发任务，按计划完成任务目标；3、负责解决开发过程中的技术问题；4、保证代码具有良好的可维护性，编写开发文档。任职要求：1、计算机及相关专业本科及以上学历，至少3年JAVA开发经验；2、熟悉面向对象编程思想，熟悉JAVA、J2EE体系结构, 熟悉JAVA开源框架，熟悉SSH，了解JVM原理；3、掌握数据库的理论知识，熟练使用MySQL数据库，理解Cache技术（Memcached、Redis等Key-Value存储系统）；4、有高并发、高负载、高可用性系统设计开发经验者优先。加分项:1、有github/博客；2、有大规模、高性能互联网服务相关的设计和实践经验；3、有代码洁癖，看到代码中的坏味道有浑身不自在的感觉；4、具备良好的学习能力和成长潜力，渴望和团队一起快速成长。其他：我们有着完善的薪资福利体系和丰富多彩的员工生活1. 一年1-2次调薪；2.年终奖：年底双薪；3.娱乐旅游活动：不定期组织室内外活动、每年省外或国外游；4.下午茶：公室零食饮料不限制提供，更有酸奶水果、每周一次下午茶会，各种无限制；5.大事补贴:逢婚、育、大病等个人大事给予礼金；6. 每月员工生日会：公司还为寿星准备礼物哦7.节日补贴：节假日组织聚餐、各种节日礼品及现金补贴；8.内部分享培训福利：鼓励内部或邀请外部牛人分享知识技能给予相应奖励；9.休假福利：7天带薪年假、调休假、双休日/法定公众假期、婚假、丧假、产假、陪产假等；10. 医疗：公司每年一次体检;11. 文化书籍福利：买什么书你说了算，公司负责采购书本供借阅共享，提高知识技能（书籍类型不限）。",https://www.lagou.com/jobs/4994652.html,22.550048,113.908321,后端中高级,20k-25k,"['后端', 'Java']",新安,深圳-南山区-前海-智恒产业园E01B栋401,3-5年
119,下午6点最活跃,云之道（深圳）信息技术有限公司,15-50人,2019-10-24 09:09:58,福田区,职位描述：                职务描述：1、参与需求分析，完成系统接口的分析设计；2、负责系统平台的开发和维护； 3、设计完成相关单元测试用例；4、开发和维护应用自动化部署&发布工具；技术要求：1、计算机相关本科毕业，5年以上开发经验，良好全面的计算机基础知识；2、良好的OOAD功底，精通设计模式，能熟练使用UML类图时序图等；3、精通Java，熟悉系统调优工具方法；4、熟悉数据库MySQL等关系型数据库相关分析设计调优经验；5、熟练掌握HTML、CSS、JavaScript、AJAX、JSON等Web相关技术；6、较好的学习能力，良好的沟通能力，独立工作和解决问题的能力；,https://www.lagou.com/jobs/6475246.html,22.52977,114.03226,后端开发工程师,12k-24k,"['MySQL', 'Javascript', 'JS', 'HTML/CSS']",香蜜湖,深圳-福田区-车公庙-天安创新科技广场二期东座402A-402B,5-10年
120,早10点最活跃,深圳市引导美电子商务有限公司,150-500人,2019-10-25 11:27:42,福田区,"职位描述：                岗位要求1、负责基于docker的node.js,mysql,mongodb,redis后台系统功能的代码编写与实现。2、负责项目功能的设计、编码、调优、测试及Bug处理。3、负责产品服务端开发，不断进行产品演进，优化系统性能，提高服务质量。4、配合web前端、APP开发，设计接口完成功能需求、编写技术及接口文档。岗位职责：1、本科或以上学历，计算机软件或通信相关专业。2、5年以上互联网行业从业经验，教育行业者优先。3、熟悉Web开发技术，深入了解互联网通讯架构。4、精通Node.js及Java相关开发框架等，有Linux部署经验，有web前端开发经验者优先。5、熟练使用git等代码管理工具，有项目管理经验。6、熟悉微信及支付相关开发，有支付宝服务窗开发经验优先。7、深入了解docker容器应用，Redis/MYSQL/MongoDB数据库，精通性能优化。8、具备强烈的工作责任心、执行力和团队合作能力，并能够承受较大工作压力。",https://www.lagou.com/jobs/4027808.html,22.533962,114.005996,后端开发工程师,10k-20k,"['后端', 'Java', 'PHP']",农林,深圳-福田区-竹子林-紫竹七道一号博园商务大厦九楼（园博园正门旁）,1-3年
121,下午5点最活跃,北京字节跳动科技有限公司,2000人以上,2019-10-26 22:05:07,南山区,职位描述：                职位职责：1、参与公司企业级产品后端的研发，确保系统的安全、高可用性和可靠性；2、参与业务需求讨论，评审产品设计，驱动研发团队一起按时、高质量完成产品交付；3、负责公司企业应用平台的开发和架构设计，保证设计和编码的质量，承担重点、难点的技术攻坚，主要开发语言为Java。职位要求：1、计算机及其相关专业，本科及其以上学历；2、有扎实的编程能力，有优秀的设计能力和代码品位，热爱编程；3、深刻理解计算机原理，有良好的数据结构和算法基础；4、较好的产品意识，愿意将产品效果做为工作最重要的驱动因素；5、对软件产品有强烈的责任心，具备良好的沟通能力和优秀的团队协作能力；6、积极乐观，认真负责，乐于协作。,https://www.lagou.com/jobs/6427849.html,22.511303,113.925766,后端开发工程师-EA,20k-30k,[],南山,深圳-南山区-南海大道2163号来福士广场15层,1-3年
122,下午3点最活跃,穆迪信息咨询（深圳）有限公司,2000人以上,2019-10-24 15:28:13,福田区,"职位描述：                ·         Take ownership of stories and interpret business requirements for these stories with the assistance of Business Analysts.·         Provide feedback on requirements from a technical perspective, and provide estimates for user stories and tasks.·         Provide input into technical design, at the story and/or module level.·         Comply with coding standards.·         Collaborate with quality assurance engineers to fix defects.·         Collaborate with build and release engineers to prepare packages and solve environment issues.·         Investigate and find the root cause for software problems reported by clients.·Qualifications:·           Minimum Bachelor’s degree in Computer Science or   related major from top institutions, Master degree is a plus. The graduated universities   of candidate must be in top 50 in China mainland or Overseas colleges and   universities.·           Deep understanding of Object Oriented design and   development·           3+  years of   professional software development experience on multi-tiered enterprise   applications.·           Experience with both relational databases and NoSQL   databases.·           Able to work well within the constructs of an agile   development process, including SCRUM, Unit Testing, Continuous Build and   Integration, etc.·           Willing to learn new technologies; capable of   self-directed learning.·           Very good verbal and written communication skills·           Ability to handle multiple assignments concurrently   and independently manage time·           Works well in a fast-paced team environment; able to   work under pressure to meet tight deadlines·           Has superb analytical skills and persistence in   problem solving.·           Experienced in Programming Languages: C#.·           Experienced in Development tools: Visual Studio, Visual   Studio Code etc.·           Experienced in Development Platforms: Microsoft   Windows, Linux.·           Experienced in Application Servers: IIS.·           Experienced in Application Frameworks & Engines: .NET   Core, ASP.NET MVC, ASP.NET WEB API, Entity Framework/Entity Framework Core.·           Experienced in Databases: SQL Server, MongoDB, Redis   etc.·           Experienced in Others: Git .·           Experienced in Restful API design and development.·           Familiar with micro-service development process is a   plus.·           Familiar with the container and container management   platform is a plus, such as Docker/K8s.·           Familiar with OpenResty/Kong is a plus.",https://www.lagou.com/jobs/5317884.html,22.53552,114.057584,(.Net/ .Net CORE) 后端开发工程师,16k-30k,"['后端', 'C#/.NET']",岗厦,深圳-福田区-岗厦-嘉里建设广场,3-5年
123,下午2点最活跃,北京字节跳动科技有限公司,2000人以上,2019-10-26 22:02:49,南山区,职位描述：                职位职责：1、负责今日头条游戏产品的后台业务研发； 2、负责头条小游戏服务端各子系统设计开发； 3、主要编程语言为Golang。职位要求：1、本科及以上学历，计算机、通信等相关专业，一年以上全职工作经验； 2、有扎实的编程能力，良好的代码抽象与架构设计能力； 3、深刻理解计算机原理，有良好的数据结构和算法基础；4、熟悉Mysql、Redis、消息队列等常用WEB组件，并有能力进行定制化改进； 5、有高并发服务、微服务设计和实现经验优先； 6、有较好的产品意识优先，有成熟上线游戏产品研发经验优先； 7、积极乐观，主动承担，责任心强，工作认真细致，具有良好的团队沟通与协作能力； 8、热爱编程，有较强的学习能力，有强烈的求知欲、好奇心和进取心 ，能及时关注和学习业界最新技术。 ‍ ‍,https://www.lagou.com/jobs/6146254.html,22.51486,113.932922,后端研发工程师-小游戏方向,20k-40k,[],南山,深圳-南山区-创业路3023号公园一号办公楼,1-3年
124,下午2点最活跃,深圳市爱思软件技术有限公司,50-150人,2019-10-24 09:37:18,南山区,职位描述：                岗位职责：1、开发和维护公司所有产品和服务的后端部分（包括但不限于客户端 API、网站及后台等）；2、利用 Node.js 和 Docker 等后端技术解决所有业务问题；3、对现有的系统和代码架构进行重构并不断优化，提高性能和可维护性，配合客户端工程师，完成代码有效对接。岗位要求：1、精通 Node.js，理解其技术架构、特性、适用场景，掌握至少一种服务端开发框架（例如 Koa、Express 等）；2、精通操作系统和网络通信原理，理解 HTTP/HTTPS 协议、文件系统、并发、分布式等概念；3、DevOps 自动化运维，熟练使用 Docker 及相关技术栈；4、数据驱动，至少掌握一到两门数据库技术（例如 MySQL、MongoDB、Redis 等），了解各种数据库的区别，理解数据层的设计和实现；5、了解公有云和私有云的区别，若有公有云的使用经验为更佳，例如 AWS、阿里云、腾讯云、Google Cloud 等（熟悉 AWS 者优先考虑）；6、对代码质量有高标准的自我要求，具有良好的代码书写习惯和重构能力，编程时头脑清晰，对前后端交互和接口的设计有一定追求（有编写单元测试习惯者优先考虑）；7、具有扎实的编程功底和建模能力，精通常用的数据结构、算法、设计模式；8、能快速学习、有效沟通，有团队合作精神，对新技术或不熟悉的领域有探索精神；9、英文读写水平良好，；10、其他优先考虑范围：有三年以上 Linux 环境下后端开发工作经验、有复杂应用开发和性能调优经验、有高可用/容灾相关工作经验、有前端开发经验或能力。,https://www.lagou.com/jobs/5806879.html,22.512389,113.940294,高级后端工程师（Node.js）,20k-35k,"['后端', 'Node.js', 'Javascript', 'JS']",后海,深圳-南山区-深圳湾-创业路1777号海信南方大厦3103,3-5年
125,下午2点最活跃,稿定（厦门）科技有限公司,150-500人,2019-10-25 15:06:53,南山区,职位描述：                工作内容1、负责业务项目和需求的开发任务2、负责基于服务端应用框架和中间件开发，打造适合公司业务发展的业务系统岗位规划和期望负责场景平台业务开发任职要求1、计算机或相关专业本科或以上学历；2、两年以上Node.js或PHP开发经验；3、熟练使用 Node.js或PHP研发，有大规模高可用的服务端服务研发经验优先。4、熟悉单元测试 & 集成测试自动化经验；5、良好的沟通能力、团队协作、解决问题能力6、熟悉Linux/Shell,https://www.lagou.com/jobs/6171749.html,22.52691,113.940586,后端开发工程师,15k-25k,['Node.js'],后海,深圳-南山区-科技园-深圳市南山区高新南九道55号微软科通大厦,3-5年
126,下午3点最活跃,深圳码隆科技有限公司,50-150人,2019-10-25 10:20:39,盐田区,"职位描述：                【公司简介】码隆科技（Malong Technologies）是一家为企业提供前沿计算机视觉技术服务的人工智能公司，专注于商品识别解决方案的原创研发和应用落地。作为入选世界经济论坛“2018科技先锋”的中国企业，码隆科技以 “以AI技术赋能企业，以科技激活百倍效率”为使命，已服务零售、时尚、安检、医疗行业众多世界五百强企业，帮助其大幅度提升效率和品质。同时，码隆科技与微软、埃森哲达成战略合作，共拓全球市场。【职位描述】1、参与视觉智能应用平台软件的设计与开发；2、参与产品核心模块的开发；3、参与并负责现有产品的维护与改进。【任职要求】1、扎实的计算机基础知识，熟悉面向对象和设计模式；2、熟练掌握至少一门高级语言，如：java, golang, python, nodejs, C++，C#等；（入职后目前主要使用python)；3、有较好的团队协作精神, 愿意主动积极的与产品/硬件/云服务沟通合作解决产品难题；4、熟悉 Linux命令行工具；5、熟悉docker者优先，熟悉云服务(阿里云、azure等)者优先。【选择我们的理由】职涯--与世界顶级技术大咖共事，提升专业能力；薪酬--极具竞争力的薪酬+五险一金+优秀员工期权激励；制度--完全扁平化管理，弹性工作制；装备--最棒的工作设施，高配笔记本、人体工学椅、宽幅办公桌。",https://www.lagou.com/jobs/5757291.html,22.553311,114.232178,后端开发工程师,20k-30k,"['后端', 'Python', '软件开发']",,深圳-盐田区-沙头角-沙盐路3018号盐田现代产业服务中心33层,3-5年
127,早9点最活跃,深圳市微课科技有限公司,50-150人,2019-10-25 18:33:26,南山区,职位描述：                职位责任1. 负责公司产品后端编码及维护2. 参与公司产品后端架构的改进和优化，确保后端服务稳定、高效3、根据产品需求，制定解决方案4、负责现有系统的性能调优等的设计与实现职位要求1. 计算机基础知识扎实，掌握数据结构和算法2. 熟悉 Java/Go/Python/Kotlin/Scala 其中一门或一门以上语言3. 熟悉 MySQL/Redis 等存储4. 熟悉 Docker/Kubernetes 等容器技术（加分）5. 熟悉 Spring framework（加分）6. 善于发现和学习提升效率的开发方式，如：函数式编程、TDD等技术和方法论（加分）7. 有优秀的解决问题能力和学习能力,https://www.lagou.com/jobs/6414706.html,22.523078,113.938844,后端开发工程师,15k-20k,"['后端', 'C++', 'MySQL']",后海,深圳-南山区-南油-软件产业基地5栋E座802e兰心书院,1-3年
128,晚上11点最活跃,深圳市客路网络科技有限公司,500-2000人,2019-10-22 09:57:52,福田区,职位描述：                【岗位职责】1. 负责Klook各线产品的开发、测试和上线2. 负责管理自身项目和需求的优先级、按时高质量交付【任职资格】1. 熟练掌握Golang/C/C++/Java语言，具有扎实的计算机基础和编程能力，熟悉常见的算法与数据结构2. 熟悉Restful接口设计，有过互联网业务系统或相关技术产品开发经验3. 有较强的工作责任心和良好的沟通协调能力，能在压力下独立解决问题4. 熟练掌握MySQL数据库，擅长SQL优化者优先5. 有熟悉一门静态（C/C++/Java）语言者优先6. 开源贡献者优先，GitHub源码者优先，技术博客者优先【KLOOK福利】1、舒适、健康、人性化的办公环境；2、扁平化的团队管理，业务飞速发展，你的能力和价值很快会被大家看到；3、开放和充满激情的国际化团队，男女高颜值并且比例协调，每个人都有那么一点传奇；4、独特的创业团队氛围会让你在完成工作之余，还有自己的时间学习、成长；5、还要跟Homie同富游：团队足迹踏遍国家50+，等你来一起占领地球；6、团队天天下午茶，周周小聚餐，月胖三斤不是梦。,https://www.lagou.com/jobs/6490360.html,22.533416,114.030246,后端开发工程师,12k-20k,"['Golang', 'MySQL', '系统架构']",农林,深圳-福田区-车公庙-天安科技创业园A座2楼KLOOK客路,1-3年
129,下午3点最活跃,深圳市中联创新自控系统有限公司,150-500人,2019-10-25 17:18:34,福田区,职位描述：                我们是谁:中联创新旗下有速力思、迈斯、康耐德三个子品牌，在数据中心、社区与通用物联网领域拥有行业领先的技术积累与持续盈利的产品线。我们的研发毕业于CMU、清华、香港大学等国内外高校，来自谷歌、华为、百度等企业。主力研发方向为：1、面向创业公司的通用物联网硬件产品与平台；2、面向专业场景的工业领域AI+控制系统。岗位职责：1、负责公司新产品的后台业务研发；2、参与工业物联网新产品线的研发工作，负责B端产品的前后台业务模块技术设计并独立完成coding工作，输出技术文档；主要实现语言为Python/Golang/Nodejs；3、完成自己开发模块的单元测试与测试用例评审，输出技术文档；4、定期了解行业内新技术方向，组内定期对自己擅长的领域做技术交流。岗位要求：1、本科及以上学历，计算机、通信等相关专业；2、有扎实的编程能力和良好代码品位；3、有优秀的系统设计能力，能熟练使用mongodb、influxdb、django/tornando、kafka等常用WEB组件/框架，并能了解工作原理；4、深刻理解计算机原理，有良好的数据结构和算法基础。加分项:1、有物联网产品和实现经验优先；2、积极乐观，责任心强，工作认真细致，具有良好的团队沟通与协作能力；3、对产品有好奇心，关注业内产品，喜欢使用产品，关注产品体验；4、热爱编程，有良好的自驱力，有较强的学习能力，有强烈的求知欲、好奇心和进取心，能及时关注和学习业界最新技术；5、能独立完成前端开发工作，至少熟练使用一个前端主流框架。欢迎对热爱技术、对自己技术成长有追求的小伙伴加入！,https://www.lagou.com/jobs/5973013.html,22.571976,114.060053,高级后端研发工程师(node/python),18k-30k,"['后端', 'Golang', 'Python', 'Node.js']",梅村,深圳-福田区-中康路128号卓越城1期,3-5年
