,activeTime,companyFullName,companySize,createTime,district,jobDetail,pageUrl,positionLat,positionLng,positionName,salary,skillLables,stationname,workAddr,workYear
0,早11点最活跃,深圳寻找母星网络科技有限公司,150-500人,2019-10-22 10:36:25,南山区,职位描述：                【我们是谁】* 寻找母星是2018年6月成立的一家互联网公司，我们做的是会员制本地生活服务平台----小黑卡* 公司的CEO是共享充电宝-街电的创始人；* 联合创始人是百姓网的首席架构师、食色的创始人；* CTO是阿里云早期创始团队成员；* 运营部门的leader是美团创业期的核心管理者、街电的中台负责人。岗位职责：1. 负责大型项目的架构升级，包括技术选型，核心功能实现和性能优化等等2. 精通Golang技术栈，有过分布式或高并发系统的开发经验3. 支撑流量及数据快速增长岗位要求：1. 熟悉golang，以及常用设计模式2. 扎实的数据结构及算法、了解多种分布式事务以及补偿机制3. 主导过至少一个高并发系统的设计实现，并上线稳定运行4. 具有极强的执行力，高度的责任感、很强的沟通能力，能够在高压下高效工作5. 精通高性能网络服务设计和开发，熟悉HTTP、TCP/IP网络协议6. 了解常用的数据库7. 了解分布式相关原理和常用解决方案加分项：1. 大型电商或互联网背景2. 积极参与开源社区，有自己的开源作品,https://www.lagou.com/jobs/6368932.html,22.543471,113.941133,Golang后端,18k-25k,"['后端', 'Golang']",高新园,深圳-南山区-大冲-科技园中区科技中三路5号国人通信大厦B座2110,1-3年
1,下午5点最活跃,亿达信息技术（深圳）有限公司,2000人以上,2019-10-25 17:14:46,南山区,职位描述：                岗位要求：* 具备linux下的Golang开发经验，熟悉Golang语法。* 熟悉Linux基本原理以及日常操作。* 熟悉常用数据结构和算法，对TCP/IP协议有所了解。* 了解数据库、安全、网络相关知识* 充满好奇心，愿意学习，有良好的沟通能力。* 有blog和github项目者优先。岗位职责：* 负责腾讯泛工业平台的后台功能开发以及维护。* 保证开发质量及开发进度要求。,https://www.lagou.com/jobs/6537997.html,22.556374,113.94679,go后端开发工程师,9k-12k,"['Golang', 'Linux/Unix']",,深圳-南山区-科技园-科技园,1-3年
2,下午4点最活跃,武汉市幸运坐标信息技术有限公司,50-150人,2019-10-25 10:06:50,南山区,"职位描述：                岗位职责：1. 负责游戏官网后端开发、业务系统后端开发；2. 负责项目需求调研、分析、方案设计等过程；3. 负责相关系统的架构设计和开发；4. 为腾讯开发部门提供技术服务，与腾讯技术人员合作实现解决方案。任职资格：1. 计算机或相近专业, 大学专科及以上学历, 一年及以上计算机相关工作经验；2. 熟悉Go语言编程, 熟悉Linux开发环境，对网络编程有相关经验；3. 熟悉mysql、redis等中间件，熟悉数据结构设计和SQL调优；4. 了解xss、csrf等安全防范5. 富有责任心和自我驱动力，能承受一定工作压力，沟通能力良好，有团队精神；6. 有良好的编程习惯和简洁清晰的代码风格，热爱技术，有极客精神，工作效率高；7. 熟悉php语言优先。",https://www.lagou.com/jobs/6450715.html,22.545769,113.945772,golang后端,8k-16k,"['后端', '服务器端', 'Linux/Unix']",高新园,深圳-南山区-大冲-科苑路讯美科技广场3号楼15C,1-3年
3,早9点最活跃,Gekko Artificial Intelligence Limited,15-50人,2019-10-24 12:15:50,宝安区,职位描述：                【关于我们】Gekko Lab 是一个年轻有活力的数据科学团队。85%是90后年轻人，气氛轻松有活力；Gekko Lab于2016年9月在美国硅谷成立，公司发展趋势迅猛，年轻却很strong。Gekko Lab的主营业务是针对金融客户提供数据咨询服务，在监管科技领域内专注金融情报和金融调查。我们提供图形网络分析软件和内置专有数据库服务，帮助用户运用数据分析技术，提升发现和管控风险的能力。 Gekko Lab的发展规划是针对二级股票市场，致力打造一个智能金融图谱引擎。我们团队多元化，来自国际投行，海归博士和**科技企业工程师，重视学习文化，工匠+极客精神，上升空间不设限。团队火箭式成长，2017年2月获得香港数码港认可，成为培育企业，2018年7月，团队从160多家企业脱颖而出，成为全亚洲八家入围埃森哲“2018亚太区金融科技创新实验室”的公司之一。2018年12月于英国获得“2018年中国最佳金融科技奖”2019年4月获得香港资讯与通讯科技奖“商业方案（大数据及开放数据应用）铜奖”欢迎有潜力爱学习的伙伴加入我们深圳团队，与我们共同成长。【任职要求】1.  计算机或相关专业的本科及以上；2.  有2年以上开发经验，编程基础扎实，熟练掌握至少一种语言，Python/Golang优先；3.  能熟练运用几种基本的设计模式，熟悉常用的软件架构，熟悉常用数据结构和算法；4.  熟悉关系/非关系型数据库的使用和基本调试优化；5.  熟悉高并发编程、缓存、队列、负载均衡，等各种服务端性能调优方案；6.  有分布式系统开发和部署经验，熟悉docker部署；7.  优秀的逻辑思维能力、学习能力，良好的沟通能力、团队协作精神；8.  熟练的英语读写和沟通能力。【岗位待遇】1.  月薪16k-32k；2.  年终奖；3.  转正即享带薪年假7天；4.  五险一金【职位诱惑】1．不设限的职业发展规划，公司领导会根据员工自身的意愿与能力进行职业培养与规划；2．有竞争力的薪水：高于行业的薪水，表现优秀，奖金多多di；3.  零食、下午茶、嗨爆的聚餐、非主流又好玩的旅游团建。,https://www.lagou.com/jobs/5988160.html,22.562554,113.873988,Python / Golang后端工程师,16k-32k,"['Python', 'Golang', '数据库', '分布式']",坪洲,深圳-宝安区-新安-新安六路众里创业社区,3-5年
4,早10点最活跃,深圳寻找母星网络科技有限公司,150-500人,2019-10-23 09:49:00,南山区,职位描述：                岗位职责：1. 负责大型项目的架构升级，包括技术选型，核心功能实现和性能优化等等2. 精通Golang技术栈，有过分布式或高并发系统的开发经验3. 支撑流量及数据快速增长岗位要求：1. 熟悉golang，以及常用设计模式2. 扎实的数据结构及算法、了解多种分布式事务以及补偿机制3. 主导过至少一个高并发系统的设计实现，并上线稳定运行4. 具有极强的执行力，高度的责任感、很强的沟通能力，能够在高压下高效工作5. 精通高性能网络服务设计和开发，熟悉HTTP、TCP/IP网络协议6. 了解常用的数据库7. 了解分布式相关原理和常用解决方案加分项：1. 大型电商或互联网背景2. 积极参与开源社区，有自己的开源作品工作地址,https://www.lagou.com/jobs/6276802.html,22.543471,113.941133,golang后端,25k-50k,"['后端', 'GO']",高新园,深圳-南山区-大冲-国人通讯大厦,5-10年
5,下午6点最活跃,深圳无内科技有限公司,15-50人,2019-10-25 15:24:52,南山区,职位描述：                1. 负责公司项目与产品的需求分析、架构设计、技术决策、开发规范及核心代码实现；任职要求：1. 本科以上学历，5年以上研发经验2. 丰富的 go/python 项目开发经验，有完整项目负责经验；3. 熟悉Docker的相关开源技术，分析过Docker源码者优先；4. 熟悉各种软件开发模式，熟悉OKR等；5. 有运维或安全产品开发经验。,https://www.lagou.com/jobs/6474997.html,22.522776,113.936407,golang后端开发工程师（中高级）,25k-35k,['Golang'],南山,深圳-南山区-科技园-粤海街道滨海社区滨海大道3398号赛西科技大厦20层2003室,3-5年
6,下午6点最活跃,深圳新超越信息技术有限公司,50-150人,2019-10-26 12:22:06,南山区,职位描述：                工作职责：1.参与金融类交易项目产品的开发2.参与需要讨论并能独立完成的程序，以及撰写程序文档； 3.与产品经理一起配合开发以及系统的日常维护；4.对测试环境，开发环境，以及线上环境能独立进行部署；5.积极的与同事进行技术交流与沟通。技能要求：1. 五年以上PHP开发经验，有 golang 开发经验为佳。有金融证券交易类、棋牌类开发经验优先考虑。2. 有一定 Linux 环境下开发经验，可以自己完成开发、调试和部署任务。3. 熟悉 Nginx、PHP 等常用组件，有实际部署经验。熟悉主流云计算产品者为佳。4. 对 mysql，redis，mongodb，kafka/rabbitmq 有使用和运维经验，了解其使用场景和特性。5. 熟悉后端主流开发框架， 有使用 swoole / go 开发过高性能 server 者经验优先考虑6. 熟悉前端开发框架 如 vue.js / react 满足基本的前端开发任务,https://www.lagou.com/jobs/6524204.html,22.53797,113.9519,Go后端开发工程师,25k-35k,"['PHP', 'GO', 'Golang', '区块链']",高新园,深圳-南山区-大冲-赋安科技大厦B座10楼1006室,5-10年
7,早10点最活跃,安克创新科技股份有限公司,500-2000人,2019-10-22 14:57:13,南山区,职位描述：                职位描述：1、负责智能产品后端API开发；2、负责智能产品后端程序的架构和优化；3、负责智能产品后端新需求的系统设计和实现职位要求：1、本科及以上学历，3年以上互联网后端开发经验；2、精通Golang、Java、Python中至少一门语言，熟悉Jscript或React；3、深入了解后端Web Service框架和技术如beego、tornado、redis、mysql；4、熟悉Web Server性能调优、大规模并发、缓存机制；5、具备DevOps的能力，熟悉Shell脚本编程，Docker容器管理，有设计和维护高可用系统经验的优先；6、良好的文档编写能力和故障排查能力，工作细心，较强的责任感和抗压能力；,https://www.lagou.com/jobs/5012280.html,22.568938,113.953402,GO后端开发工程师,15k-25k,['GO'],茶光,深圳-南山区-健兴科技大厦B座,3-5年
8,下午5点最活跃,北京市商汤科技开发有限公司,2000人以上,2019-10-25 16:23:48,南山区,职位描述：                岗位职责： 1、参与AI相关产品及系统的研发、测试，维护和发布； 2、参与AI相关产品及系统的需求调研和需求分析，撰写相关技术文档。  任职要求： 1、计算机相关专业本科及以上学历，具有3年以上相关工作经验； 2、熟练掌握Go语言，有2年以上Golang项目开发经验，熟悉C/C++优先；3、具有RESTful应用的相关设计开发经验，熟悉后端系统的基础架构设计； 4、熟悉多线程和网络编程，有分布式系统项目经验优先；5、熟悉docker/mysql/mongodb/redis/kafka等工具；6、具有丰富的linux下高性能程序的调试工作，熟悉性能提升的技巧； 7、能阅读和理解优秀的开源系统代码，有参与开源代码或者开源框架贡献者优先。,https://www.lagou.com/jobs/5566559.html,22.494927,113.920038,Golang系统开发工程师,25k-40k,['C++'],水湾,深圳-南山区-南海大道1052号海翔广场,5-10年
9,下午2点最活跃,深圳市和讯华谷信息技术有限公司,500-2000人,2019-10-25 09:41:13,南山区,职位描述：                岗位职责：1、负责消息推送系统API 相关服务开发及维护2、参与后台系统架构设计3、保证系统的高性能及高可用4、负责新技术的预研和技术难点的突破岗位要求：1、本科以上学历，具有2年及以上互联网服务端开发工作经验；2、熟悉golang语言编程，掌握HTTP、TCP/IP等网络相关技术；3、熟练掌握 Restful API 接口设计标准及规范；4、熟悉MySql、Redis、RabbitMQ等开源中间件；5、具备高可用、高并发分布式系统开发设计经验优先； 6、熟悉Python，C/C++优先；7、热爱学习，有自我驱动意识，积极主动，责任心强，有很好的抗压能力及团队精神。,https://www.lagou.com/jobs/4362394.html,22.550007,113.907458,golang开发工程师,15k-30k,"['GO', 'Golang', 'Java']",新安,深圳-南山区-南头-智恒产业园16栋2楼,3-5年
10,早10点最活跃,深圳对对科技有限公司,50-150人,2019-10-25 20:32:22,南山区,职位描述：                职位描述：1、负责大型项目的架构升级，包括技术选型，核心功能实现和性能优化等等 ；2、精通Golang技术栈，有过分布式或高并发系统的开发经验；3、 支撑流量及数据快速增长 。        任职要求：1、熟悉golang，以及常用设计模式 ；2、扎实的数据结构及算法、了解多种分布式事务以及补偿机制 ；3、 主导过至少一个高并发系统的设计实现，并上线稳定运行 ；4、具有极强的执行力，高度的责任感、很强的沟通能力，能够在高压下高效工作； 5、 精通高性能网络服务设计和开发，熟悉HTTP、TCP/IP网络协议 ；6、 了解常用的数据库 ；7、了解分布式相关原理和常用解决方案。,https://www.lagou.com/jobs/6096835.html,22.52548,113.939733,Go/Golang开发工程师,15k-30k,"['Golang', 'GO', '后端', 'C++']",后海,深圳-南山区-高新南九道与高新南十道交汇处卫星大厦1709,3-5年
11,早11点最活跃,北京市商汤科技开发有限公司,2000人以上,2019-10-25 16:23:48,南山区,职位描述：                岗位职责： 1、参与AI相关产品及系统的设计、研发、测试，维护和发布； 2、参与AI相关产品及系统的需求调研、需求分析和系统设计，撰写相关技术文档。  任职要求：1、计算机相关专业本科及以上学历，具有7年以上相关工作经验； 2、熟练掌握Go语言，有5年以上Golang项目开发经验，熟悉C/C++优先；3、具有RESTful应用的相关设计开发经验，熟悉后端系统的基础架构设计； 4、具有分布式、微服务项目开发经验，具有架构设计或小团队带领经验者优先；5、熟悉docker/mysql/mongodb/redis/kafka等工具；6、具有丰富的linux下高性能程序的调试工作，熟悉性能提升的技巧； 7、能阅读和理解优秀的开源系统代码，有参与开源代码或者开源框架贡献者优先。,https://www.lagou.com/jobs/6241861.html,22.494447,113.920521,高级Golang开发工程师,25k-40k,"['GO', '后端', 'Linux/Unix', 'docker']",水湾,深圳-南山区-南海大道1052号海翔广场,5-10年
12,下午3点最活跃,心灵失重（北京）科技有限公司,150-500人,2019-10-25 10:07:22,南山区,职位描述：                工作内容：参与糗事百科的后端研发；保障产品的快速迭代与服务质量；任职资格：三年以上高并发系统的设计与调优经验，对系统的架构与实现有清晰的认识；熟悉linux系统生产环境搭建与调优；至少熟悉 Python/Golang/C/C++ 其中一种语言熟练掌握Mysql数据库的使用与优化；熟悉至少一种web框架的使用和调优，并了解其基本原理扎实的编程功底，能享受编程乐趣；高效的学习能力和分析解决问题能力；本科及以上学历；,https://www.lagou.com/jobs/3553779.html,22.99368,113.993578,Golang,15k-30k,"['GO', 'Golang', 'Java', 'Python']",,深圳-南山区-科技园-科技园,3-5年
13,晚上7点最活跃,深圳市云翰教育科技有限公司,15-50人,2019-10-14 14:58:38,龙岗区,"职位描述：                职位诱惑：公司发展前景广阔，办公环境舒适，文化氛围好，双休！不定期的下午茶，团建，旅游活动等！深圳市云翰教育科技有限公司，以""改善教育行业""为愿景的创业公司，围绕“专注教育培训机构盈利增长”理念，推出有“超级拼课”“章鱼校长”“学员卡”等产品，帮助教育培训机构轻松管理校区，增长口碑，提升学员续费率，高效招生。工作职责: 1.负责平台系统底层技术研发、性能调优；推进平台架构演进使之更好地适应变化的需求； 2.根据产品和项目需求，参与需求对接、研发设计，参与系统搭建、调优和技术对接等工作； 3.参与设计并实现高可用、可扩展、分布式平台系统，推进核心产品技术在大规模场景下快速。 岗位要求：1. 理解并掌握以下技术： Linux, Docker, Go, SQLSQL, Git, Http, CI;2.理解代码的设计模式，有良好的数据结构与算法功底，有强烈的代码质量意识;3.理解 SaaS 的架构原理。对微服务、batch、分布式以及常见架构有所认知;4.熟悉 Kubernetes, Docker, Etcd 等开源组件的架构及实现;5. 熟悉 CI/CD 工具，以及敏捷开发流程;6. 有较好的沟通和业务理解能力，乐于解决具有挑战性的问题，善于跟进新技术的发展;7.有大型在线系统、微服务、分布式系统设计和开发经验，优先考虑;8.能阅读外文技术博客，优先考虑;地址：深圳市龙岗区坂田街道坂雪岗大道与永香路交汇处，创汇国际中心10楼1003",https://www.lagou.com/jobs/6209873.html,22.650441,114.083514,Golang 后端研发工程师,15k-30k,"['GO', 'docker', 'MySQL']",,深圳-龙岗区-坂田-坂田街道创汇国际中心1003,3-5年
14,早9点最活跃,深圳华游文化科技有限公司,15-50人,2019-10-24 09:36:26,福田区,职位描述：                工作职责:  负责B2B网站平台系统底层技术研发、性能调优； 根据产品和项目需求，参与需求对接、研发设计，参与系统搭建、调优和技术对接等工作 负责在线交易系统（订单流、支付流、对账）研发；任职资格：  本科或以上学历，计算机软件或相关专业，3年以上相关经验 计算机基础扎实，有良好的数据结构与算法功底，有强烈的代码质量意识 熟悉Linux开发环境，精通Go，至少熟悉shell，ruby等至少一门脚本语言 有大型在线系统、微服务、分布式系统设计和开发经验者优先,https://www.lagou.com/jobs/6385830.html,22.564938,114.050546,Go后端开发工程师,15k-20k,['后端'],梅村,深圳-福田区-梅林街道天欣大厦6楼603,1-3年
15,早9点最活跃,平安科技（深圳）有限公司,2000人以上,2019-10-27 00:00:09,南山区,"职位描述：                工作职责负责平安云平台分布式存储产品的后台开发。任职要求1. 至少三年以上golang开发经验，深入理解goroutine、channel、reflect 等实现机制2. 熟悉etcd、docker、 kubernetes，在生产环境有实际使用经验3. 熟悉Linux 内核,有系统性能调优经验者优先4. 有存储相关经历，了解ceph、nfs协议优先5.有技术热情和较强的学习能力，对于新技术有浓烈的好奇心，有很好的问题分析和技术攻关能力，具有良好的团队合作能力、沟通能力。",https://www.lagou.com/jobs/6499635.html,22.543099,114.057868,1121SJ-Golang研发工程师,15k-30k,"['GO', 'Golang', '分布式', '云计算']",岗厦,深圳-南山区-嘉联支付大厦,3-5年
16,下午5点最活跃,深圳米趣玩科技有限公司,50-150人,2019-10-25 17:38:58,南山区,职位描述：                岗位职责：1、负责服务器的架构搭建、功能研发；2、后端团队建设，带领服务器团队保质保量完成项目进度，帮助其他成员成长。任职要求：1、本科以上学历，5年以上游戏后台开发经验，其中Go语言有3年以上开发经验；2、有良好的逻辑思辨，具备快速分析和解决问题的能力；3、积极进取的价值观，和其他团队能够无缝接合；4、Golang开发经验丰富，对于语言的各种特性具有深入的认知；5、 熟悉网络编程框架，具备网络调优的能力；6、 熟练掌握多机通信框架，对服务器架构有自己的理解，能够搭建和维护服务器机群；7、熟练掌握Linux操作系统和Shell编程，能够快速修复服务器的各种异常和故障；8、 熟悉各种数据库的原理和使用，包括redis、mysql及分布式数据库等；9、熟悉异步和并发编程框架，释放服务器的多核潜力；10、强烈的责任心与危机意识，积极发现项目和团队的问题，防患风险于未然。,https://www.lagou.com/jobs/6321485.html,22.529351,113.952494,Go/Golang游戏服务器主程,20k-40k,"['Golang', 'GO', 'Linux/Unix']",高新园,深圳-南山区-大冲-深圳湾科技生态园10栋B座4楼A10,5-10年
17,下午3点最活跃,深圳市明源云客电子商务有限公司,2000人以上,2019-10-25 10:50:29,南山区,"职位描述：                岗位职责:1. 负责开发云客高可用、高效、稳定的产品及系统服务，根据业务需求，设计并实现技术解决方案，研究互联网领域最新技术成果，并应用于产品中；2. 完善并遵守团队的编码规范，编写高质量、高效率、结构清晰、易读、易维护的代码。3. 主动关注各项系统指标，优化提升系统性能，提升产品服务质量。4. 参与服务端后台系统架构设计，以及服务所需的基础组件的实现，解决业务发展遇到的问题，提升系统稳定性。岗位要求：    1. 本科及以上学历，计算机相关专业，两年以上服务端研发经验；2. 深入理解计算机原理，有扎实的数据结构和算法基础；3. 深入理解linux系统及其原理，熟悉常用数据结构的使用，熟悉TCP/IP、HTTP协议以及网络编程；4. 良好的编码和文档习惯，对代码美感的追求孜孜不倦；5. 熟悉c++/java/golang/php等语言,至少一种，有一年以上golang研发经验优先；6. 熟悉go语言框架代码，至少了解一个go开源项目；7. 了解grpc协议; 熟悉常用的sql、nosql数据库原理，阅读和理解优秀的开源系统代码；具有分布式系统设计和开发经验者优先。",https://www.lagou.com/jobs/3792193.html,22.537847,113.952429,Golang工程师,18k-30k,"['后端', 'GO', 'Golang', 'PHP']",高新园,深圳-南山区-中科大厦9层,3-5年
18,下午6点最活跃,深圳市拉科菲希科技有限公司,150-500人,2019-10-26 14:22:31,南山区,"职位描述：                1、负责业务系统架构设计与开发； 2、解决项目中遇到的问题，进行系统性能优化，安全加固，保证系统安全、稳定、快速运行；3、根据需求参与项目开发和维护，参与制定前后端业务流程，接口协议，文档输出等；4、参与建设大数据平台，包括数据采集、传输、存储、计算、可视化等底层能力；5、参与海量数据的建模、处理、分析和挖掘工作；各类统计，完成日常数据分析查询需求；数据仓库建设；6、参与各业务模型基础数据及用户画像相关体系建设；任职要求：1、大学本科以上学历，2年以上工作经验，熟悉golang语言，基础扎实，1年以上golang开发工作经验，有完整的项目经验 ；同时熟练掌握C++/Python任意一门语言者优先;2、熟悉Golang协程，精通channel和锁，对高并发、高可用架构系统有正确、深刻的理解，有分布式服务设计或开发经验者优先；3、有Web开发经验，对RESTful概念有清晰的理解，并至少有一次API Server开发项目中运用到；4、熟悉xml/json/protobuf等至少任意一种网络通信技术和数据交换格式；5、良好的算法基础和清晰的编程思路；熟悉tcp，ip，http等网络协议；6、熟悉MySQL，熟悉数据库原理和常用性能优化技术，同时熟悉其他数据库（如Redis、MongoDB等）者优先；7、熟悉微服务docker,k8s者优先；熟悉HDFS/HBase/Hive/Storm/Spark/Spark Streaming/Kafka/flume 等相关技术；有多个或多年大数据项目的实施经验优先；8、工作积极主动，态度踏实认真，有较强的职业素养和工作操守；具有良好的团队合作精神，有较强的开发能力和灵活性；9、对技术有激情，喜欢钻研，能快速接受和掌握新技术，学习能力和工作责任心强，良好的沟通表达能力和团队协作能力；加入luckyfish你将享受以下福利：1、内部培训/行业交流2、定期内部培训，由经验丰富的同事、互联网企业的大咖导师来与你分享同行跨界的知识。3、单身联谊聚会。4、定期举办单身帅哥美女联谊聚会。5、每日下午茶/零食/宵夜6、每日下午茶福利，吃不完的零食、宵夜。7、每周团建/娱乐8、每周进行高尔夫、网球、桌游、电影等丰富活动。每月生日会9、为当月生日同事举办隆重的生日party并赠送生日礼物。季度/年度公费旅游10每季度市区、周边城市旅游，年度国内外旅游。人均5000标准。",https://www.lagou.com/jobs/6457036.html,22.541052,113.951368,Golang,25k-40k,"['后端', 'GO', 'Golang']",高新园,深圳-南山区-科技园-大冲商务中心A座3003,3-5年
