,activeTime,companyFullName,companySize,createTime,district,jobDetail,pageUrl,positionLat,positionLng,positionName,salary,skillLables,stationname,workAddr,workYear
352,早10点最活跃,深圳市光逸科技有限公司,50-150人,2019-10-26 09:58:51,福田区,职位描述：                工作职责： 主导公司产品后台业务系统的架构设计和开发工作； 开发高性能爬虫系统抓取电商平台页面数据，为业务提供正确稳定的数据源； 参与系统核心功能模块的技术攻关，协助解决项目中的技术难题； 参与产品需求评审，负责项目排期，跟进项目进度； 负责单元测试、集成测试，提高测试覆盖率，保证产品质量。 任职要求： 计算机或相关专业，本科及以上学历，3年以上PHP项目开发经验； 扎实的计算机基础，熟悉数据结构，有较强的算法设计能力； 熟悉PHP实现和工作原理，熟练使用Swoole，可根据PHP的短板引入新的技术提升后台系统的性能、稳定性； 熟练使用MongoDB、Redis、Memcache、MySQL，可根据业务场景架构存储方案； 熟悉TCP/IP原理，熟悉网络服务程序开发，对负载均衡、容错等有深入理解； 具备良好的代码编程习惯及较好的文档编写能力，要求贯彻优雅代码以及性能最优化的开发思想； 具备丰富的后端行业知识，了解各相关领域的前沿信息，了解最新后端技术的设计和实现原理，并能在开发中灵活应用； 自我驱动力强，有责任心、敬业精神和良好的沟通协作意识，有指导新人/带团队经验。待遇福利： 朝九晚六，周末双休； 入职即购买五险一金，另有年度奖金、带薪年假，定期评估调薪； 完善的培训体系及晋升机制，人性化管理，扁平灵活； 工作环境棒，每周下午茶或运动健身、每月生日会、定期海内外旅游，各种节假日的happy hour，零食饮料不限量。,https://www.lagou.com/jobs/5559616.html,22.562132,114.097342,高级PHP开发工程师,18k-30k,"['后端', 'PHP']",银湖,深圳-福田区-八卦三路八卦岭424栋2楼,3-5年
353,早10点最活跃,招商证券股份有限公司,2000人以上,2019-10-25 13:05:44,南山区,职位描述：                职位描述： 1、负责前端产品及核心组件的开发、优化工作；2、负责研究最新的前端技术并将成果应用于前端开发工作；3、负责前端团队代码质量及开发标准管理。任职要求：1、Web开发经验至少3年，熟悉前端常用库JQuery、Bootstrap；2、熟悉前端组件化、Node模块化；熟悉前后端通信原理，熟悉HTTP协议；3、精通react、vue、angular之一并有前端架构设计经验；4、精通前端工程化构建工具，至少有一个大型项目开发经验；5、对业界最新的前端技术和实现有浓厚的兴趣和深入的见解；6、有参与或提交过前端开源项目者优先。,https://www.lagou.com/jobs/3270160.html,22.530488,113.948829,Web前端开发工程师,20k-40k,['Web前端'],后海,深圳-南山区-高新南九道9号金地威新软件科技园6号楼4楼,3-5年
354,下午3点最活跃,深圳码隆科技有限公司,50-150人,2019-10-25 10:20:39,盐田区,"职位描述：                【公司简介】码隆科技（Malong Technologies）是一家为企业提供前沿计算机视觉技术服务的人工智能公司，专注于商品识别解决方案的原创研发和应用落地。作为唯一入选世界经济论坛“2018科技先锋”的中国企业，码隆科技以 “以AI技术赋能企业，以科技激活百倍效率”为使命，已服务零售、时尚、安检、医疗行业众多世界五百强企业，帮助其大幅度提升效率和品质。同时，码隆科技与微软、埃森哲达成战略合作，共拓全球市场。【职位描述】1、搭建稳固高效的软件平台，将深度学习算法应用到实际的业务场景中；2、参与视觉智能应用平台的设计与开发。【任职要求】1、扎实的计算机基础知识，熟悉面向对象和设计模式；2、熟练掌握至少一门高级语言，如：java, golang, python, nodejs, C++，C#等；（入职后目前主要使用python)；3、熟悉 Linux命令行工具；4、熟悉tensorflow, pytorch, caffe等常用框架者优先。【选择我们的理由】职涯--与世界顶级技术大咖共事，提升专业能力；薪酬--极具竞争力的薪酬+五险一金+优秀员工期权激励；制度--完全扁平化管理，弹性工作制；装备--最棒的工作设施，高配笔记本、人体工学椅、宽幅办公桌。",https://www.lagou.com/jobs/5757370.html,22.553311,114.232178,算法系统集成工程师,20k-30k,"['后端', '平台', 'Python', '算法']",,深圳-盐田区-沙头角-沙盐路3018号盐田现代产业服务中心33层,3-5年
355,下午2点最活跃,深圳市懒人在线科技有限公司,150-500人,2019-10-25 09:48:02,南山区,职位描述：                岗位职责：1.负责公司移动端网站重构开发；2.负责各类运营活动开发；3.负责运营后台功能模块开发；4.负责持续优化 Web 前端性能、安全和交互体验；5.负责改进 Web 前端开发流程，搭建前端自动化、工程化框架；6.负责公司产品页面代码规划和布局，保证产品页面表现层的整体性和可维护性。任职要求:1.3 年及以上 Web 前端开发工作经验；2.熟悉 HTML5、JavaScript、CSS3，能解决常用浏览器的兼容性（IE、Chrome、FireFox）问题；3.熟练使用主流前端开发框架（Vue、React、Angular等）和开发工具，熟悉前端面向对象及模块化开发、组件化开发；4.了解 HTTP 协议原理及应用，并能熟练运用 Ajax 进行数据交互；5.熟悉 MV* 框架，有微信公众号、小程序等移动端开发经验；6.熟悉前端安全风险和对策，熟悉站点性能优化的方法并且在实际项目中有性能优化的实战经验；7.具有良好的分析和解决问题的能力，能独立完成任务，具有把控系统进度的能力；8.对新技术有一定了解，热爱学习；9.有前后端分离成功实践者优先；10.熟悉前端工程化者优先；11.熟悉 Nodejs、有 Express、Koa2、Egg.js 项目开发经验者优先。,https://www.lagou.com/jobs/6266450.html,22.546157,113.946882,web前端工程师,10k-18k,"['HTML', '前端开发', 'Web前端']",高新园,深圳-南山区-大冲-深圳市南山区科苑大道讯美科技广场1号楼10A,3-5年
356,下午5点最活跃,深圳市惠普优选科技有限公司,15-50人,2019-10-25 09:17:04,宝安区,"职位描述：                岗位职责：1、参与公司各个项目中的Web前端页面设计、开发以及实现，包括H5以及PC。2、与后端人员配合，高质量完成前端开发工作。3、完成的页面进行维护和对网站前端性能做相应的优化。（目前主要用vue、jquery框架）任职要求：熟悉HTTP协议,熟悉ws协议,熟练使用git代码管理工具。熟悉模块化开发；熟悉前端常用库及框架。熟练javascript、ajax、dom等原生代码编写，掌握面向对象编程思想，能有一定的编写基础框架和ui组件能力；熟练使用Vue.JS全家桶。掌握其原理，能独立开发常用组件（须有项目实战经验）。有使用node.js开发过实际项目者加分。使用过vue+ssr或者nuxtjs的优先。抗压能力较强，能适应加班，能主动承担责任，有良好的沟通能力以及团队协作精神；能接受异地出差工作，最好有护照。",https://www.lagou.com/jobs/3996973.html,22.546942,113.885767,web前端开发,15k-25k,"['HTML', 'Javascript', 'Web前端']",宝安中心,深圳-宝安区-新安-新安街道卓越前海时代广场A座1404,3-5年
357,早10点最活跃,深圳市范特西科技有限公司,150-500人,2019-10-25 09:05:02,南山区,职位描述：                岗位职责：1.负责游戏AI工程平台研发，包括前后端系统架构设计与实现。2.负责游戏AI系统设计，包括球员策略及球队战术等算法。3.负责优化现有游戏系统AI表现。4.负责AI编辑器维护与优化。任职要求：1.计算机相关专业，本科及以上学历。2.具备扎实数学/算法功底，对机器学习、概率统计、遗传算法等算法原理有所了解，ACM等算法大赛获奖者优先。3.熟悉状态机、分层状态机、行为树，有游戏AI相关工作经验者优先。4.有足球或篮球游戏研发经验者优先。,https://www.lagou.com/jobs/6038171.html,22.530438,113.952696,游戏AI工程师,20k-40k,"['前端开发', 'Unity3d']",高新园,深圳-南山区-科技园-深圳市南山区深圳湾科技生态园9栋B座19层08-14室,不限
358,早10点最活跃,深圳乐信软件技术有限公司,2000人以上,2019-10-22 15:23:04,南山区,职位描述：                职位描述：1、与产品经理、设计师和后端工程师共同开发会员业务；2、关注前端前沿技术研究，能够将所学和团队一起分享一起进步，并服务于业务；3、能结合业务对具体的产品进行针对性的性能优化，实现极致的用户体验；4、能够在理解业务的基础上，通过技术驱动业务的发展，持续提升用户体验；5、能够主动的开发出提高团队工作效率的自动化工具，关注团队工作流程的优化。任职要求：1、5年以上Web前端开发经验；2、精通html/js/ajax等前端技术，熟练使用常见JS框架但不依赖框架；3、精通HTTP协议，熟悉TCP/IP的基本工作原理，熟悉各种Web标准规范；4、对前端工程化与模块化开发有较深理解，较强的性能分析和调优能力，熟悉常见的前端优化技巧并有实践经验；5、熟悉至少一门服务器端编程语言，对OOP有较深理解；有移动web app项目经验者优先；6、对前端技术和团队工作能有持续的热情，逻辑思维清晰，善于进行跨团队的交流和合作；7、有良好的团队协作精神，勇于接受挑战并能够承受压力，能主动和团队分享，主动提高自身在团队的影响力。,https://www.lagou.com/jobs/5815347.html,22.538345,113.944704,前端开发工程师（管理岗） (MJ000544),20k-40k,[],高新园,深圳-南山区-高科技中心中国储能大厦,5-10年
359,早9点最活跃,金蝶软件（中国）有限公司,2000人以上,2019-10-26 17:12:35,南山区,职位描述：                职位职责： 1、主要负责生态门户网站框架设计、后端开发和持续优化；2、与产品、UI设计、前端开发其人员协作实现产品功能； 3、相关技术的预研和疑难问题的解决，参与技术方案选型，编写相关开发文档、技术资料等。任职要求： 1、大学本科以上学历，计算机及相关专业，具有2-5年Nodejs开发工作经验； 2、熟悉html/css，熟悉各种web标准规范，熟悉H5开发； 3、掌握web前端开发技术，使用至少一种主流框架（vue/react），并对其原理有深刻理解； 4、深入理解web安全性能原理； 5、有MySQL、ORACLE等相关数据库使用经验； 6、具备良好的学习能力、分析解决问题的能力和沟通协调能力，高度责任心和团队合作精神。,https://www.lagou.com/jobs/6368420.html,22.533911,113.954951,node.js全栈开发工程师（金蝶云苍穹）,15k-25k,"['平台', 'Node.js']",高新园,深圳-南山区-科技园-科技园科技南十二路2号金蝶软件园,3-5年
360,下午6点最活跃,深圳市一面网络技术有限公司,50-150人,2019-10-25 18:57:48,南山区,职位描述：                 产品的需求调研、技术方案制定以及设计报告的撰写； 产品后端数据模型以及接口开发； 产品维护。任职要求： 精通 Python，有良好的编码习惯； 有独立项目开发经验，开发过完整的产品； 熟练掌握至少一门 Python Web 开发框架（Flask 优先，Django、Tornado 等）； 熟悉 Redis、MySQL、MongoDB 等常用数据库，具备相关使用经验； 熟悉 Javascript，了解 HTML、CSS，具备一定前端开发能力 熟练使用 Linux 操作系统； 有较强的学习能力、团队协作意识，有良好的沟通、需求理解能力，问题解决能力。加分项： 有优质技术博客、GitHub 积极贡献者优先； 具备大数据技术使用或开发经验者优先。关于我们： 我们是一个年轻的数据科学团队，希望通过技术改变商业世界，实现数据驱动的精细化研究、运营与决策。我们的产品正在持续服务国内外顶尖的企业，包括多家大型快消企业，时尚大牌，国际一线汽车厂商，以及著名对冲基金； 我们团队里有许多顶尖的开发者和数据科学家，来自腾讯、百度、快播、华为、BCG、麦肯锡，毕业于海内外著名高校； 我们获得了来自著名投资机构的三轮投资，资金充足，处在高速发展的上升期。但我们仍然是一个小公司，你的加入仍然可以对公司的发展轨迹产生明显的影响和贡献。公司福利： 有竞争力的薪酬：工资、一年两次调薪机会、五险一金、年终奖、节假日福利、生日礼物等。既有情怀，又有“钱”途； 合理的工作时间：我们有弹性工作时间制度，并追求使用技术去高效解决问题，不提倡加班； 团队活动：YiMBA系列课程、每周的篮球和羽毛球运动，每周分享会，每月聚餐、生日会等。我们是一个有凝聚力的团队； 年度体检：豪华体检，健康强壮的身体是工作的基础； 零食饮料：不间断的供应丰富优质的零食饮料； 年度旅游：前脚去泰国后脚去巴厘岛，随着团队的壮大，以后能去得更远； 舒适的工作环境：我们有一个漂亮的办公室，开放式的设计和十分开阔壮观的窗景... ....,https://www.lagou.com/jobs/5523086.html,22.54064,113.939945,Python 工程师（产品研发）,10k-20k,[],高新园,深圳-南山区-深南大道9966威盛科技大厦1408,1-3年
361,早10点最活跃,深圳乐信软件技术有限公司,2000人以上,2019-10-22 15:23:03,南山区,职位描述：                职位描述：1、负责现金业务web前端的开发工作；2、负责前端页面的开发和性能优化；3、负责前端架构建设，公共组件的设计开发。任职要求：1、5年及以上工作经验，前端基础知识扎实，熟练掌握原生 JS、CSS、HTM；2、熟悉主流js框架，有应用Vue或weex的项目经验；3、对Web前端技术有强烈兴趣，能对Web前沿技术研究和新技术调研，有良好的学习能力和团队合作精神；4、熟悉web后端开发技术，有php，nginx，mysql，linux开发使用经验优先；5、代码风格良好，有一定的架构设计经验更好；6、有良好的团队协作精神，勇于接受挑战并能够承受压力，能主动和团队分享，主动提高自身在团队的影响力。,https://www.lagou.com/jobs/5815684.html,22.538345,113.944704,前端开发工程师-XJ (MJ000565),20k-40k,[],高新园,深圳-南山区-高科技中心中国储能大厦,5-10年
362,早10点最活跃,深圳市维创通科技有限公司,15-50人,2019-10-25 19:44:10,南山区,职位描述：                技能要求J2EE  数据库  Java  中间件 算法有很强的代码编写能力，有一定的算法能力职位描述：1、独立完成特定模块微服务框架、功能开发、接口开发、联调测试、应用部署和数据建表、数据库开发；2、梳理和优化后端基础架构和组件，常态化性能调优。3、后端组长角色，管理后端团队；指导初中级工程师。任职资格：1、全日制本科或以上学历，计算机相关/软件工程等相关专业2、技术背景深厚，并有软件架构设计经验3、精通Java语言，五年以上Java后端开发经验，掌握JVM原理，对Java基础框架有深入了解4、精通数据库设计、分析、代码编写和调试，熟悉至少一种主流关系数据库架构产品，比如postgresql、oracle、sqlserver、mysql等5、精通主流开源Web框架（SpringBoot、SpringCloud等），熟悉常用的中间件技术（如缓存、消息队列、调度框架等）6、有很强的自我管理并且愿意融入到一个快速交付的工作环境,https://www.lagou.com/jobs/6419978.html,22.531747,113.930888,高级java工程师,20k-40k,"['后端', '中间件', 'J2EE', '分布式']",南山,深圳-南山区-桃园西海明珠大厦,5-10年
363,下午3点最活跃,深圳市明源云客电子商务有限公司,2000人以上,2019-10-25 10:50:28,南山区,职位描述：                定位：敏捷开发小组的中坚力量，中高级定位，能够独挡一面，独立完成开发任务，对技术有追求，渴望突破和创新。团队技术氛围好，牛人多，定期组织技术交流和分享，个人成长空间大。一、岗位职责1、熟悉敏捷开发模式，根据设计文档和开发规范，独立编写高质量代码；2、参与需求分析，进行功能设计并根据需求搭建开发环境；3、发现并修复BUG，不断优化现有产品，提高产品稳定性、可扩展性及用户体验；4、参与开发成果评审，关注前沿技术研究，并应用于项目开发中。二、任职要求1、本科以上学历，计算机相关专业，3-5年的JavaScript开发经验，具备良好的面向对象编程基础（优秀者大专亦可）；2、精通JavaScript、Ajax、Jquery、HTML、CSS等前端技术；3、掌握angular、react、vue等前沿框架，熟悉ES6标准，掌握一种后端开发语言更佳；4、熟悉nodejs，了解nginx等web服务器配置，熟悉linux命令；5、熟悉http，熟悉各种浏览器终端的兼容性，对Web前台的性能优化以及Web常见漏洞有一定的理解和实践；6、热爱前端开发，关注新技术的发展动态，并能结合实际运用，代码风格严谨工整，有技术攻坚能力；7、工作积极主动，有钻研和进取精神，能和团队高效配合、良好沟通。,https://www.lagou.com/jobs/5644133.html,22.537847,113.952429,中高级前端开发工程师（建模平台/开发云/DMP）,25k-35k,['前端开发'],高新园,深圳-南山区-深圳市南山区高新南三道中科大厦9楼,3-5年
364,下午3点最活跃,深圳市三维通机器人系统有限公司,15-50人,2019-10-24 12:50:24,南山区,"职位描述：                岗位职责：1. 遵循公司相关技术标准、规范，高质量完成设计、开发任务；2. 参与系统需求分析和详细设计工作；3. 参与项目详细设计文档、部署文档、需求文档等相关文档的编写，建立完整的项目档案；4. 协助完成项目测试、系统上线工作，对项目实施提供支持；5. 参与方案讨论和技术调研等工作。 任职要求：1. 3年及以上使用Java语言的前后端开发经验；2. 熟练掌握J2EE技术体系（JSP,Servlet,Jdbc等），熟练使用MyBatis/Spring/SpringMVC 等应用框架；3. 熟练掌握MySQL、SQL Server等数据库中的一种或多种；4. 熟悉Linux/Unix操作系统；5. 熟悉javascript、html、css、Ajax 结合的前端开发模式；7. 熟悉面向对象开发方法和设计模式，熟悉敏捷开发流程，有较强的逻辑思维能力，思路清晰；8. 对技术有热情，能主动根据工作需要钻研、学习新的技术；9. 工作态度认真踏实，有积极学习的心态，具有较强的责任心和耐心，有良好的沟通理解能力及团队合作精神，具备较强的抗压能力。公司一周五天半制。",https://www.lagou.com/jobs/5531252.html,22.528499,113.923552,java开发工程师,15k-25k,"['嵌入式', '自动化']",南山,深圳-南山区-西丽-聚创金谷创意园C栋411,3-5年
365,早10点最活跃,腾讯科技（深圳）有限公司,2000人以上,2019-10-24 12:05:30,南山区,职位描述：                工作职责：负责腾讯pcg的波洞星球后台研发与运营；负责后台的架构设计、开发、优化以及运营工作；负责责提出海量服务的解决方案，针对高并发高负载服务开发基础设施；负责一些部门和事业群的公共平台和组件的后台研发和运营。负责新项目开发中技术难点的攻关和预研工作。工作要求：两年以上工作经验（社招），工作经验匹配度高优先（工作地点 深圳）具备良好的分析解决问题能力，能独立承担任务，有系统进度把控能力；责任心强，具有良好的对外沟通和团队协作能力，主动，好学；熟练Unix/Linux下C/C++开发和程序性能调优；同时熟悉golang更佳；熟悉Unix/Linux操作系统原理及常用工具；熟悉TCP/IP协议、进程间通讯编程，熟悉Unix/Linux下常用架构设计方法；具备全面的软件知识结构认知（操作系统、软件工程、设计模式、数据结构、数据库系统、网络安全）优先；了解Mysql等数据库，熟悉NoSQL存储，熟悉面向对象设计；,https://www.lagou.com/jobs/5793645.html,22.540582,113.933759,动漫后台开发工程师（C++）,15k-30k,"['服务器端', 'C++', '分布式', 'Linux/Unix']",桃园,深圳-南山区-万利达科技大厦,3-5年
366,早10点最活跃,杭州有赞科技有限公司,2000人以上,2019-10-26 13:33:13,南山区,职位描述：                岗位职责：1.负责公司电商业务开发2.以业务为核心，为了优化用户体验和提高稳定性、效率等，推进公司前端基础设施建设。岗位内容：1、核心技术栈：React(PC)，微信小程序，Vue (Mobile)，Node(中间层)。2、参与面向商家的Sass系统开发。3、参与面C端的移动商城开发。4、参与基于业务和技术场景的架构、性能优化。5、参与开发流程改进，公共组件和工具建设，用技术手段提高生产力。6、咱们无需兼容IE，几乎不做活动页，专注把技术发挥到**。7、咱们对新技术保持开放态度，每年有公费参加行业会议的机会。8、咱们标配 Macbook Retina + 大显 + 机械键盘;9、阅读、分享、写博客是咱们的日常习惯。任职条件1、本科及以上学历。2、扎实的计算机基础。3、优秀的逻辑思维和编程能力。4、HTML、CSS、JavaScript 基础扎实。5、熟悉一个主流前端框架。符合以下任一条件者优先：1、苹果重度用户、Linux爱好者 加分。2、参与开源并贡献过代码 加分。3、有后端、iOS、Android开发经验者 加分。4、有大规模前端项目开发经验者 加分。如果你还没有准备好，可以参考以下tips来接近你的目标喔：1、学习主流mvvm框架的思想和最佳实践。2、掌握前端性能调优和问题排查相关工具和方法。3、了解互联网产品级前端开发相关的工程方法和思想。,https://www.lagou.com/jobs/6522676.html,22.524003,113.935394,前端开发工程师-深圳-00056,15k-30k,['前端开发'],南山,深圳-南山区-芒果网大厦11层,3-5年
367,早11点最活跃,深圳点猫科技有限公司,2000人以上,2019-10-26 10:29:15,南山区,"职位描述：                工作职责:1. 分析产品业务需求，根据需求进行快速迭代开发；2. 后端系统的设计和开发工作；3. 根据需求和原型设计前后端接口和数据结构文档；4. 指导初级开发工程师和解决碰到的技术难点问题。任职资格:1. 本科及以上学历，3年以上JAVA/node.js后端项目开发经验；2. 熟练使用开源框架Spring、SpringMVC，SpringBoot、MyBatis等；3. 熟悉Mysql,Redis, 且有一定的SQL优化经验；4. 熟练使用ActiveMQ、Kafka等消息中间件至少一种；5. 熟悉分布式系统的相关技术。",https://www.lagou.com/jobs/6162950.html,22.501172,113.888127,Java开发工程师,15k-25k,['后端'],,深圳-南山区-前海信利康大厦,3-5年
368,下午2点最活跃,深圳市和讯华谷信息技术有限公司,500-2000人,2019-10-25 09:41:13,南山区,"职位描述：                工作职责： 1、各产品线 Web 端功能设计、开发和实现； 2、各产品线易用性改进和 Web界面技术优化； 3、 设计开发高效可复用的UI组件，提高开发效率和维护成本。4、Web 前沿技术研究和新技术调研，利用各种 Web技术进行开发，致力于通过技术改善用户体验。任职资格：1、本科以上学历2、熟悉 javascript，熟悉但不依赖任何Javascript框架，能够脱离各JS类库后熟练地进行开发；3、熟悉各种 Web前端技术，包括 HTML/XML/CSS等，有基于 Ajax的 RIA应用开发经验；4、扎实的计算机基础和解决问题能力，熟悉基础算法。5、对前端技术有持续的热情，个性乐观开朗，逻辑性强；优先条件：1、 熟悉Angular.js, React,js 或其他前端MVC框架优先。2、 有后端开发经验者(如Java, Node.js, Python等)优先。",https://www.lagou.com/jobs/901917.html,22.550224,113.908469,前端开发工程师,10k-20k,[],新安,深圳-南山区-关口二路智恒战略性新兴产业园7栋,1-3年
