,activeTime,companyFullName,companySize,createTime,district,education,financeStage,industryField,jobDetail,pageUrl,positionLat,positionLng,positionName,salary,skillLables,stationname,workAddr,workYear
336,下午3点最活跃,深圳白骑士大数据有限公司,50-150人,2019-10-25 20:29:36,南山区,本科,A轮,"企业服务,金融",职位描述：                职位描述：1.深入了解消费金融信贷行业现状，分析其业务痛点。2.持续跟踪资产质量，分析客群特征，协助团队为客户提供专业的指导意见和建议。3.关注国内政策和环境变化，对不同客群的整体风险特征有相当认识，协助团队对区域性风险、行业风险作出预判对策。4.持续跟进客户策略使用情况，协助客户更好的防范风险，服务金融客户。5.持续推进风控策略的测试和执行落地，从数据维度不断监控风险指标的变化，及时作出分析调整。任职要求：1.本科及以上学历，金融、财务、数学、计算机相关专业，1年及以上工作经验。2.熟悉消费金融或银行信用卡业务产品，了解其风控运营模式，曾从事消费金融风控工作。3.熟悉线上反欺诈和信用风险管理，能制定应对的风险防控措施和解决方案。4.熟悉各类风险统计量化指标，懂得如何计算及分析数据背后的含义。5.对数据敏感，懂得如何分析海量数据，掌握SQL、Python、SAS、R软件中的一种或几种。6.思维活跃，善于沟通，具备团队协作能力。7.能接受服务客户，从客户角度出发，诚实勤奋，态度积极，有主人翁意识，不畏压力，敢于突破自己。,https://www.lagou.com/jobs/6365287.html,22.546158,113.946884,风控策略高级经理-反欺诈,10k-20k,"['风控', '风险分析', '风险管理', '风险评估']",高新园,深圳-南山区-大冲-讯美科技广场1号楼27层,1-3年
337,早11点最活跃,深圳左邻永佳科技有限公司,150-500人,2019-10-25 17:45:39,南山区,本科,A轮,移动互联网,职位描述：                职位描述：1. 负责与产品沟通业务需求、开发前端页面以及对接后端API2. 负责修改公司现有产品bug，并对产品的持续优化改进3. 负责或参与新产品前后端架构设计与开发4. 负责撰写相关的技术文档职位要求：1. 1年以上前端开发经验，计算机相关专业、本科211以上院校优先2. 熟悉web前端开发基础技能（HTML/CSS/JavaScript)3. 熟悉至少一种常见前端框架，React/Vue/Angular等，熟悉React相关开发经验者优先4. 对前端工程化与模块化开发有一定了解，有webpack/gulp/npm实践经验者优先5. 对web开发有浓厚兴趣，能主动学习，并积极主动跟进业界步伐6. 有良好的编码习惯，重视代码质量，Don't repeat yourself7. 善于沟通，工作积极，有责任心，善于协作与分享，有一定抗压能力。,https://www.lagou.com/jobs/5340734.html,22.544498,113.945967,web前端工程师,12k-20k,[],高新园,深圳-南山区-大冲-科技园金融基地2栋9AB,1-3年
338,下午2点最活跃,深圳市博悦科创科技有限公司,500-2000人,2019-10-27 10:18:57,福田区,本科,不需要融资,移动互联网,职位描述：                【任职要求】：1、本科以上学历，2年及以上数据仓库开发经验2、熟悉数据仓库理论，能够根据业务需求进行数据仓库设计开发3、熟悉SQL开发并能够进行优化4、熟练掌握Hive开发，熟悉Hadoop生态相关工具者优先5、熟悉shell，python者优先考虑6、喜欢钻研，善于沟通，有团队合作精神【岗位职责】：1、负责投资相关业务相关指标的梳理和计算2、负责数据仓库模型设计和开发3、负责数据仓库ETL开发4、上级交办的其他任务,https://www.lagou.com/jobs/5795241.html,22.551764,114.096235,数据库开发工程师,10k-15k,"['Hive', 'MySQL', 'ETL']",黄木岗,深圳-福田区-购物公园平安大厦,1-3年
339,下午3点最活跃,深圳市递四方信息科技有限公司,500-2000人,2019-10-25 19:46:12,宝安区,本科,D轮及以上,"移动互联网,电商",职位描述：                岗位职责：1.负责公司产品各个版本的测试，通过bug驱动产品产品质量提升和开发效率提升；2.与产品经理、开发共同协作，推进故障解决，评估质量改进效果；3.参与需求、架构、测试需求、测试用例等的评审；4.根据需求分析，制定测试计划、设计测试用例；5.负责测试发现缺陷的风险评估，协调定位修复缺陷，并生成测试报告；6.推动自动化测试，提高测试效率；7.测试方法的创新、推广。任职资格：1.两年以上自动化测试相关经验；2.深刻理解常用的开源自动化框架，selenium、robotframework等；3.熟悉Java或者Python语言；4.熟悉持续集成技术和Jenkins等开源工具；5.熟悉常用的数据库，如MySQL、Oracle，及非关系型数据库，Redis、MongoDB等；6.熟悉常用的Linux命令，能进行环境部署；7.具有良好的分析能力、逻辑能力、责任感、事业心及学习能力；8.熟悉接口测试，了解常用的接口测试工具：postman、jmeter等；9.有开发高扩展性，可靠性强的自动化框架者优先。,https://www.lagou.com/jobs/3752358.html,22.567199,113.867674,软件测试工程师（自动化）,10k-18k,"['测试', '脚本', '自动化']",西乡,深圳-宝安区-西乡-西乡街道宝源路138号财富港大厦D座25层,5-10年
340,早10点最活跃,深圳苹果树数据科技有限公司,150-500人,2019-10-25 09:48:07,南山区,本科,A轮,"金融,数据服务","职位描述：                工作职责：1.负责语义理解、分类/聚类等系统构建；2.负责对话文本特征提取、语义理解、详情提取、对话结果生成算法研究及实现；3.负责大规模文本数据处理和数据挖掘；职位要求：1.计算机或相关专业本科及以上学历,2年以上NLP相关工作经验2.有扎实的编程基础，熟悉Java及 Python 语言，对算法和数据结构有深入研究； 3.熟练机器学习方面的基础理论知识，对深度学习等当前热点和前沿技术有完整和系统的认识；4.熟悉TensorFlow框架和TF-Serving5.熟悉NLP相关算法（分词、词性标注、命名实体识别、文本分类、聚类等），熟悉NLP和文本挖掘的关键技术，并有一定的研究成果或项目经验，有语义理解开发经验者优先；6.责任心强，有较强的分析和解决问题能力，有良好的沟通协调能力和团队合作意识。",https://www.lagou.com/jobs/4988022.html,22.524488,113.937694,NLP自然语言处理工程师,25k-50k,"['语音识别', '语音合成', '算法', 'NLP']",南山,深圳-南山区-科技园-软件产业基地2C栋1904B,3-5年
341,下午5点最活跃,深圳市玖昔科技发展股份有限公司,50-150人,2019-10-25 09:14:38,南山区,大专,B轮,"移动互联网,区块链",职位描述：                我们需要您：1. 负责后台服务的部署、维护、监控、优化和发生故障时及时响应处理，保障服务稳定；2. 负责公司自动化运维平台研发；3. 优化运维流程并按流程实施，提升运维效率；4. 负责开发环境系统需求支持，日常运维工作；我们希望您：1. 精通linux的管理及优化；2. 精通mysql/redis/MongoDB等数据库的管理和优化；3. 熟悉python/shell语言，有自动化运维开发经验；4. 有较强的系统性能及相关故障分析排查能力；5. 熟悉zabbix系统监控工具；6. 熟悉nginx+php平台的软件部署管理和监控调优；7. 具备良好工作责任心、安全意识、沟通交流能力。,https://www.lagou.com/jobs/4869026.html,22.548259,113.94354,高级运维开发工程师,10k-20k,['运维'],高新园,深圳-南山区-科技园-科苑路15号科兴科学园B2栋903,1-3年
342,早11点最活跃,深圳尚米网络技术有限公司,150-500人,2019-10-26 17:18:35,宝安区,本科,不需要融资,"移动互联网,电商",职位描述：                【工作职责】1、  负责产品（包括App和Web前、后端）的全功能测试、性能测试和安全性测试，确保产品版本的发布质量；2、参与产品的需求讨论，根据产品需求制定测试策略、测试方案以及测试计划，设计测试用例；3、与开发团队沟通配合，完成产品迭代过程中的测试任务，解决测试过程中的各种技术问题，协调和安排好测试工作；4、根据产品特点，使用合适的测试工具或自动化解决方案，提高测试效率；5、其它流程改进和质量提升相关工作。【任职资格】1、本科及以上学历（非本科学历请勿投递），计算机相关专业；2、熟练掌握软件测试理论和方法，1-3年以上测试工作经验； 3、熟练使用java语言或一种以上的面向对象编程语言，熟悉shell、python等一种脚本语言； 4、熟练操作linux系统完成测试环境搭建和维护；熟练掌握一种以上关系型数据库，熟悉sql使用； 5、熟练掌握一种自动化测试框架，能够完成单元测试和接口自动化测试； 6、对软件测试有浓厚兴趣，有很强的分析问题和定位问题的能力，突出的沟通与推动能力。【福利待遇】1、薪资福利优厚，有年终奖金，表现优秀一年有多次调薪机会；2、充满活力的工作氛围，舒适的办公环境，非常nice的老板，年轻化的团队；3、公司为员工缴纳五险一金，提供免费的下午茶，自助零食供应，全勤、节日小礼品等福利；4、公司不定期提供员工旅游、聚餐等活动，让您充分感受到团队的温馨；5、享有国家法定节假日，带薪病假等一系列的丰富假期；,https://www.lagou.com/jobs/6373761.html,22.577642,113.922353,软件测试工程师,6k-10k,"['测试', '软件测试', 'app测试']",洪浪北,深圳-宝安区-新安-留芳路6号庭威产业园1号楼2楼西侧/兴东地铁站A出口直走,1-3年
343,下午3点最活跃,深圳市中联创新自控系统有限公司,150-500人,2019-10-25 17:18:34,福田区,本科,未融资,移动互联网,"职位描述：                工作职责： 1. 负责公司产品Web前端及node/python后端开发工作2. Web前沿技术研究和新技术调研；跟进业界流行技术，并运用在工作中3.带领一个3-4人小团队完成平板、PC以及手机端开发工作，给出小组成员技术成长指导资格要求： 0.最重要的：有良好技术功底并且热爱技术、对未知的一切充满好奇，对于做出一个好的产品充满热情;1. 本科及以上学历，计算机、通信及相关专业，相关工作经验2年以上； 有大厂工作经历优先2. 精通HTML/XHTML、CSS等网页制作技术，熟悉页面架构和布局； 3. 精通JavaScript、Ajax等Web开发技术,熟练运用至少一款主流的JS框架；精通至少一门后端语言4. 熟悉用户交互设计理论，热衷分析并改善产品的用户体验； 5. 具备工程化的前端思维，具备较好的问题分析与解决能力； 6. 思路清晰，具备良好的沟通能力和团队协作能力，善于学习、总结，乐于分享； 7. 有较强的学习能力和较高的学习热情；具备积极向上的创业心态，良好的职业素质，具备成熟的团队协作意识。",https://www.lagou.com/jobs/4697821.html,22.571976,114.060053,高级全栈工程师（偏前端),18k-36k,"['JS', '全栈']",梅村,深圳-福田区-中康路128号卓越城1期,3-5年
344,下午2点最活跃,北京字节跳动科技有限公司,2000人以上,2019-10-26 21:58:06,南山区,本科,C轮,文娱丨内容,职位描述：                职位职责：1、负责将深度学习的算法迁移到手机端；2、开发和优化移动端inference框架；3、移动端并行化神经网络加速的技术探索和落地。职位要求：1、精通c/c++，精通算法与数据结构，熟悉python；2、具备较好的计算机体系结构背景和软件开发背景，熟悉arm neon指令及汇编优化，或者熟悉移动端gpu优化；3、了解深度学习基本原理，熟悉神经网络基本架构和各layer计算方式，熟悉至少一种深度学习训练框架及其模型文件的解析，如caffe、tensorflow、pytorch；4、熟悉常用图像视觉计算库及深度学习推理计算库，包括arm compute library、tensorflow lite、nnpack、ncnn等；5、熟悉常用的卷积计算加速方法，如gemm、winograd算法等；6、熟悉深度学习定点化计算，熟悉支持定点化的深度学习训练框架如ristretto，熟悉支持定点化的推理引擎计算库如qnnpack等。其他加分项：1、熟悉神经网络模型压缩框架，如pocketflow、distiller等；2、设计过AI加速器软件栈。,https://www.lagou.com/jobs/5634995.html,22.954071,113.243864,高性能计算架构工程师-抖音（移动端推理引擎方向）,35k-65k,['图形处理'],,深圳-南山区-南海大道2163号来福士广场17层,不限
345,下午3点最活跃,深圳市阿卡索资讯股份有限公司,2000人以上,2019-10-26 19:28:24,罗湖区,本科,C轮,"教育,移动互联网","职位描述：                岗位描述：（初中高级目前都在招）1、负责产品的前端的技术方案设计并参与开发；2、完成Web前端与后端服务交互的设计和开发；3、参与开发和完善前端开发库，建立完整前端技术体系和基础库4、对用户体验有强烈的敏锐感，持续优化用户体验和前端性能，解决各种浏览器的兼容性问题 ； 5、关注前沿技术，并能通过技术创新提高快速帮助业务达成目标；岗位要求：1、本科及以上学历，4年以上开发经验，参与过大型互联网系统前端开发；2、精通各种Web前端技术和标准(Javascript/ES6、HTML/HTML5、CSS/CSS3)，熟悉页面架构和布局，对表现与数据分离、Web语义化等有深刻理解；3、精通常见开源前端框架，理解源码，可对其扩展和优化，自己开发过公共开发库、框架；4、精通React.js, Redux ,Vue.js等主流框架进行SPA开发，熟练使用less或sass进行前端开发，精通webpack、gulp等构建工具配置和使用；5、对前端工程化与模块化开发有一定了解，能够设计高扩展性的前端应用;6、至少熟悉一门非前端的语言（如Java/C#/PHP/C/C++/Python/Ruby），并有实践经验；7、具备良好的团队协作精神，能利用自身技术能力提升团队整体研发效率，提高团队影响力；8、对技术有激情，喜欢钻研，能快速接受和掌握新技术，有较强的独立、主动的学习能力，良好的沟通表达能力和团队协作能力。加分项：1、熟悉Webgl，用Three.js等3D库开发过3D可视化项目；2、了解VR、AR，做过类似项目；3、同事眼中或自认为前端或JS高手，精于技术，想要成为业内专家；",https://www.lagou.com/jobs/5283118.html,22.558503,114.106928,资深web前端开发工程师,15k-25k,"['Javascript', 'CSS']",笋岗,深圳-罗湖区-深圳市罗湖区桃园路254号HALO广场四期5-9层,3-5年
346,早10点最活跃,深圳市前海房极客网络科技有限公司,150-500人,2019-10-26 09:49:50,南山区,本科,B轮,"移动互联网,企业服务",职位描述：                （目前需要中级和高级开发工程师，中级3-5年经验，高级5年以上大数据开发经验）工作职责：1. 参与大数据平台的建设和维护2. 参与设计数据仓库模型、构建分层体系、元数据管理及核心应用开发3. 参数据服务的开发，为其他部门提供数据服务岗位要求：1. 本科或以上学历，计算机相关专业2. 熟悉数据仓库模型设计和ETL开发经验，该领域2年以上的工作经验3. 掌握Java/Python/Scala一种或者多种语言4. 熟练使用 SQL，至少熟悉一种关系型数据库5. 基于Hadoop的大数据体系有深入认识，具备相关产品（Hadoop、Hive、HBase、Spark、Storm、Flume、sqoop、Kafka、ES等）项目应用研发经验6. 思路清晰，具备良好的沟通能力和理解能力，较强的学习能力以及快速解决问题的能力；7. 具有高度的责任心和团队合作精神,https://www.lagou.com/jobs/5550164.html,22.512676,113.940791,大数据开发工程师,20k-40k,"['Hadoop', '数据仓库', 'ETL']",后海,深圳-南山区-后海总部基地海信南方大厦18层,5-10年
347,早10点最活跃,深圳市前海房极客网络科技有限公司,150-500人,2019-10-26 09:49:50,南山区,本科,B轮,"移动互联网,企业服务",职位描述：                工作职责： 1、负责参与软件项目的需求分析，测试点设计，关注项目需求的可测性，并能预先评估项目的风险，与开发团队合作，负责测试方案和检验标准的制定；2、实施软件测试，完成对产品的集成测试、系统测试及必要的自动化建设，同时根据需要完成产品的性能、安全、协议等方面的测试； 3、主要负责系统的功能，接口，性能及稳定性测试； 4、负责对软件问题进行跟踪分析和报告，推动测试中发现问题及时合理地解决。任职要求： 1、计算机软件或相关专业，本科及以上学历； 2、3年及以上测试工作经验，有互联网及移动互联网产品测试开发经验； 3、精通测试理论和方法论，并有良好的实践经验； 4、熟悉使用MongoDB数据库，对网络协议有一定了解，能够针对服务器进行接口，性能及压力测试等； 5、熟悉至少一门脚本开发语言（如python），有实际实践经验和理解的积累者优先考虑，能够编写自动化测试脚本； 6、掌握主流测试工具，例如LoadRunner、Selenium、Webdriver，Jmeter、Robot Framework，能够编写自动化测试脚本；7、工作细致严谨，吃苦耐劳，有极强的抗压精神，有良好的学习能力，肯钻研能且有很高的投入度，有良好的沟通能力。,https://www.lagou.com/jobs/6300655.html,22.512676,113.940791,软件测试工程师（中、高级）,13k-20k,"['自动化', '测试', '软件测试']",后海,深圳-南山区-后海总部基地海信南方大厦18层,3-5年
348,下午2点最活跃,深圳市海那边科技有限公司,150-500人,2019-10-25 18:10:52,南山区,本科,B轮,"电商,消费生活","职位描述：                职位描述：1、负责前端界面开发，并配合后端工程师完成页面交互、数据展示、联调等工作；2、解决不同浏览器不同版本的兼容性,解决不同手机型号兼容性；3、负责公司网站、移动端相关界面的开发，前端交互功能开发，前端优化；4、与设计、产品经理、项目经理沟通，保证产品的质量和开发进度；5、持续的优化相关的产品的质量、性能、用户体验。6、UI组件库开发；任职要求：1、四年以上 Web 前端工作经验，自学能力强，关注前端高新知识，有成熟项目经验；2、独立编写JavaScript ，熟练使用AJAX/JSON进行前后端交互；3、熟练使用VUE，对市面主流JS库有所了解；4、熟悉前端MVC架构，熟悉各种前端调试工具，熟悉JS性能优化；5、能快速编写符合web标准的页面,能够快速定位前端BUG并及时解决；6、熟悉HTML5+CSS3，有响应式布局相关经验；7、有Mobile Web的开发经验，能开发兼容移动版浏览器的应用，并且能实现各种交互效果；8、熟悉前端模块化，组件化设计，有UI组件库开发经验更佳；",https://www.lagou.com/jobs/6040818.html,22.99368,113.993578,高级前端开发工程师,20k-30k,"['Web前端', 'HTML5', '移动端']",,深圳-南山区-科技园-大冲国际中心5号楼3201,3-5年
349,早10点最活跃,北斗一线（深圳）科技有限公司,15-50人,2019-10-25 16:12:50,南山区,大专,不需要融资,游戏,"职位描述：                岗位职责：1、负责游戏Nodejs功能模块的开发、维护工作；2、能独立完成针对游戏逻辑功能（比如核心玩法，游戏排行榜等）的开发设计；3、能独立完成简单的游戏界面功能4、负责相关数据管理，游戏后端维护管理工作。5、能与同事良好沟通、配合完成任务 任职要求：1、2年及以上JavaScript，nodejs，mysql开发经验；2、有对接支付接口经验者优先；3、精通HTML5、CSS3、JavaScript等前端技术，了解 HTTP 协议以及浏览器原理；熟悉跨终端、跨浏览器的开发模式和平台特性，了解业界技术发展状况；4、学习能力强，喜欢尝试新知识；5、熟悉前后端性能优化，并对用户体验、可用性、易用性以及UCD的设计理念有一定理解和研究；6、有 Node.js, pomelo使用经验优先；7、有责任心，有承受压力、按计划完成任务、使命必达的执行力8、有棋牌类型游戏开发经验者优先。各种福利：1、双休、五险一金（入职即买）、各种带薪假期，每月生日会；2、扁平化管理，与CEO勾肩谈未来，谈理想，与其大拿切磋技术；3、我们很重视你的每一个意见和建议；4、十点上班，睡自己的觉，让别人挤公交去；",https://www.lagou.com/jobs/6267814.html,22.541408,113.932925,node.js 开发工程师,15k-30k,"['C#/.NET', 'Node.js', 'Javascript']",桃园,深圳-南山区-前海-比克大厦,1-3年
350,早11点最活跃,智言科技(深圳)有限公司,50-150人,2019-10-25 14:13:11,南山区,本科,B轮,"数据服务,其他",职位描述：                岗位描述：1、负责项目实施全过程管理，有效控制项目目标、进度和范围，识别和控制项目风险；2、编制项目实施计划，独立编写实施部署方案及文档，有效的控制客户需求，解决项目实施过程中遇到的各种问题；3、负责公司产品软件安装、配置、优化、维护以及产品的私有化部署；4、保持与客户方的良好合作和有效沟通，确保项目进度及顺利验收。任职要求：1、本科以上计算机或通信相关专业，3年以上系统集成开发经验， 熟悉linux操作；2、掌握 shell 编程，掌握 python 编程优先；3、熟悉 Docker容器技术；4、沟通能力强，执行能力强，抗压能力强，能够独立完成客户现场的工具部署以及定制开发；5、有定制开发经验者优先。此岗位需根据项目情况经常外派出差，投递者请知悉。,https://www.lagou.com/jobs/5805690.html,22.538684,113.957429,项目实施工程师,10k-18k,"['项目管理', '过程管理', '实施']",高新园,深圳-南山区-白石洲-先健科技大厦2008,3-5年
351,早10点最活跃,深圳蓝贝科技有限公司,500-2000人,2019-10-25 12:34:59,南山区,本科,C轮,"消费生活,移动互联网","职位描述：                岗位职责：1、 负责产品的服务端功能测试、接口测试、性能测试等；2、 负责服务端测试环境的搭建、维护，以及生成环境变更验收；3、 参与需求评审、技术评审，编写测试计划、测试用例、执行测试，出具测试报告；4、 推动并监督整个服务端项目QA流程规范的实施，出具质量报告。岗位要求：1、 本科或以上学历，具有2年以上互联网公司后端服务测试工作经验；2、 熟悉Unix/Linux工作环境, 灵活使用shell脚本，可以搭建测试环境，熟悉mysql数据库，能够熟练编写SQL操作数据库；3、 熟悉性能测试方法，熟练使用主流性能测试工具，如jmeter，locust，gatling；4、学习能力强，具有较强逻辑思维能力，经验总结归纳抽象能力和表达能力 ；5、有接口自动化测试经验，开发过接口级自动化框架者、性能测试框架者优先。",https://www.lagou.com/jobs/5771633.html,22.527343,113.942156,测试工程师,8k-12k,['测试'],后海,深圳-南山区-科技园-北理工创新大厦11楼,1-3年
