,activeTime,companyFullName,companySize,createTime,district,education,financeStage,industryField,jobDetail,pageUrl,positionLat,positionLng,positionName,salary,skillLables,stationname,workAddr,workYear
222,早11点最活跃,深圳瓦拉数字技术有限公司,50-150人,2019-10-26 09:14:42,宝安区,本科,B轮,"移动互联网,金融",职位描述：                【岗位职责】：持续优化虚拟资产交易撮合引擎，搭建高性能、高可用、安全的后端技术架构。【任职要求】：1、熟悉golang或c++开发，3年以上实际项目经验，懂得一门其他编程语言，比如PHP、Java、Python；2、了解tcp/ip协议，有socket编程经验，了解http协议，有web开发经验；3、对高并发、异步有深刻理解；4、掌握mysql、redis或其他数据库，能够独立设计数据库表格并优化数据库语句；5、良好的逻辑思维，能够独立分析问题与解决问题6、有阅读开源项目源码爱好者优先，算法和数据结构爱好者优先。项目用Go开发，如果你只有C/C++经验也可以。,https://www.lagou.com/jobs/6417338.html,22.551716,113.88742,高级Go/C++开发工程师,20k-40k,"['C++', 'GO', '区块链', '全栈']",翻身,深圳-宝安区-新安-前海中心创业一路与新湖路交叉口壹方中心,3-5年
223,早10点最活跃,安克创新科技股份有限公司,500-2000人,2019-10-22 14:57:13,南山区,本科,不需要融资,移动互联网,职位描述：                职位描述：1、负责智能产品后端API开发；2、负责智能产品后端程序的架构和优化；3、负责智能产品后端新需求的系统设计和实现职位要求：1、本科及以上学历，3年以上互联网后端开发经验；2、精通Golang、Java、Python中至少一门语言，熟悉Jscript或React；3、深入了解后端Web Service框架和技术如beego、tornado、redis、mysql；4、熟悉Web Server性能调优、大规模并发、缓存机制；5、具备DevOps的能力，熟悉Shell脚本编程，Docker容器管理，有设计和维护高可用系统经验的优先；6、良好的文档编写能力和故障排查能力，工作细心，较强的责任感和抗压能力；,https://www.lagou.com/jobs/5012280.html,22.568938,113.953402,GO后端开发工程师,15k-25k,['GO'],茶光,深圳-南山区-健兴科技大厦B座,3-5年
224,早10点最活跃,富途网络科技（深圳）有限公司,500-2000人,2019-10-25 10:52:01,南山区,不限,上市公司,金融,"职位描述：                职位诱惑：精英团队,弹性工作,行业独角兽,福利待遇为员工提供全方位金融知识，亲密接触股市大神来了就是核心岗位，发展空间巨大同事氛围欢乐+节日定制礼物+各种员工娱乐协会岗位职责：1、负责面向用户侧的证券业务相关系统流程的研发，包括但不限于开户、资金业务、新股认购等；2、负责面向内部用户的CRM系统的设计与研发；3、对现有的Web业务系统的维护、升级改造和性能优化；4、与团队其他角色紧密配合工作，共同创造稳定易用的产品；任职要求:1、2年以上的Web后端开发经验，行业背景不限，大厂开发经验优先，入职后会以PHP或nodejs作为开发语言；2、熟练使用MySQL，良好的数据库设计和丰富的优化经验；3、熟悉NoSQL技术(redis，memcached等）；4、有Web安全意识，熟悉常见的Web安全问题以及防御措施；5、理解微服务架构，有微服务设计和开发经验者从优；6、熟悉linux web开发平台及工具，熟悉nginx服务器的配置优化工作；7、了解web前端开发技术和常见的前端优化技巧；8、有较强的学习能力，有良好沟通能力以及团队协作精神，能够承担工作压力；9、具备良好的编程习惯和规范；",https://www.lagou.com/jobs/5586164.html,22.549117,113.944617,证券业务Web后端/PHP/Nodejs开发工程师,14k-28k,"['后端', 'PHP', 'MySQL', 'Node.js']",高新园,深圳-南山区-科技园-深圳市深圳市南山区科技园中区科苑路15号科兴科学园D栋1单元25层,不限
225,下午4点最活跃,深圳康佳电子科技有限公司,2000人以上,2019-10-18 11:23:51,南山区,本科,不需要融资,"电商,物联网",职位描述：                岗位说明：1、参与系统架构设计2、负责web后端的功能模块的开发3、负责服务器性能优化岗位要求：1. 计算机相关专业本科及以上学历；2. 两年以上的Web开发经验；3. 扎实的Java基础，能够熟练使用Spring、SpringMVC、SpringBoot、ibatis/mybatis等框架开发，能使用Redis，Memcache进行数据、缓存处理；4. 精通TCP/IP、HTTP等网络传输协议5. 精通关系型数据库Mysql的设计、开发，对sql优化有一定的了解；6. 思想敏捷、思想灵活具有极高的主人公意识和团队协作能力，较强的学习能力及执行力；7. 拥有服务器部署运维经验者优先；8. 有大型Web系统开发经验者优先。,https://www.lagou.com/jobs/5884720.html,22.539519,113.956948,web后端开发工程师,9k-12k,"['后端', '服务器端']",高新园,深圳-南山区-大冲-深圳市南山区粤海街道科技园科技南十二路28号康佳研发大厦17层,1-3年
226,早11点最活跃,深圳瓦拉数字技术有限公司,50-150人,2019-10-26 09:14:43,宝安区,大专,B轮,"移动互联网,金融",职位描述：                【岗位职责】：持续优化虚拟资产交易撮合引擎，搭建高性能、高可用、安全的后端技术架构。【任职要求】：1、熟悉golang开发，3年以上实际项目经验，懂得一门其他编程语言，比如PHP、Java、Python；2、了解tcp/ip协议，有socket编程经验，了解http协议，有web开发经验；3、对高并发、异步有深刻理解；4、掌握mysql、redis或其他数据库，能够独立设计数据库表格并优化数据库语句；5、良好的逻辑思维，能够独立分析问题与解决问题6、有阅读开源项目源码爱好者优先，算法和数据结构爱好者优先。,https://www.lagou.com/jobs/6419771.html,22.551716,113.88742,区块链-高级GO/Golang开发工程师,20k-40k,"['分布式', '后端', 'Golang', 'GO']",翻身,深圳-宝安区-新安-前海中心创业一路与新湖路交叉口壹方中心,5-10年
227,早11点最活跃,深圳瓦拉数字技术有限公司,50-150人,2019-10-26 09:14:44,宝安区,本科,B轮,"移动互联网,金融",职位描述：                【岗位职责】：持续优化虚拟资产交易撮合引擎，搭建高性能、高可用、安全的后端技术架构。【任职要求】：1、熟悉golang或c++开发，3年以上实际项目经验，懂得一门其他编程语言，比如PHP、Java、Python；2、了解tcp/ip协议，有socket编程经验，了解http协议，有web开发经验；3、对高并发、异步有深刻理解；4、掌握mysql、redis或其他数据库，能够独立设计数据库表格并优化数据库语句；5、良好的逻辑思维，能够独立分析问题与解决问题6、有阅读开源项目源码爱好者优先，算法和数据结构爱好者优先。项目用Go开发，如果你只有C/C++经验也可以。,https://www.lagou.com/jobs/6438020.html,22.551716,113.88742,高级Go/C++开发工程师,20k-40k,"['C++', 'Golang', '区块链', '全栈']",翻身,深圳-宝安区-新安-前海中心创业一路与新湖路交叉口壹方中心,3-5年
228,早10点最活跃,富途网络科技（深圳）有限公司,500-2000人,2019-10-25 10:52:03,南山区,不限,上市公司,金融,职位描述：                职位诱惑：行业独角兽，精英团队，技术氛围浓厚岗位职责：1. 负责公司web基础系统的研发，如登录注册系统，通用消息系统，图片系统等；2. 负责web中心微服务建设架构建设的研发工作；3. 负责后端通用基础组件、开发框架的研发建设；4. 与团队其他角色紧密配合工作，共同创造稳定易用的产品；任职要求:1. 2年以上的Web后端开发经验，语言不限(PHP/Python/Nodejs/C++)2. 熟练使用MySQL，良好的数据库设计和丰富的优化经验3. 熟悉NoSQL技术(redis，memcached等）4. 有Web安全意识，熟悉常见的Web安全问题以及防御措施5. 熟悉linux web开发平台及工具，熟悉nginx服务器的配置优化工作6. 熟悉常用后端开发框架，有微服务开发经验者优先7. 了解web前端开发技术和常见的前端优化技巧8. 有较强的学习能力，有良好沟通能力以及团队协作精神，能够承担工作压力,https://www.lagou.com/jobs/5533127.html,22.549117,113.944617,基础架构Web后端开发工程师,14k-28k,['后端'],高新园,深圳-南山区-科技园-深圳市深圳市南山区科技园中区科苑路15号科兴科学园D栋1单元25层,1-3年
229,下午4点最活跃,武汉市幸运坐标信息技术有限公司,50-150人,2019-10-25 10:06:50,南山区,大专,未融资,移动互联网,"职位描述：                岗位职责：1. 负责游戏官网后端开发、业务系统后端开发；2. 负责项目需求调研、分析、方案设计等过程；3. 负责相关系统的架构设计和开发；4. 为腾讯开发部门提供技术服务，与腾讯技术人员合作实现解决方案。任职资格：1. 计算机或相近专业, 大学专科及以上学历, 一年及以上计算机相关工作经验；2. 熟悉Go语言编程, 熟悉Linux开发环境，对网络编程有相关经验；3. 熟悉mysql、redis等中间件，熟悉数据结构设计和SQL调优；4. 了解xss、csrf等安全防范5. 富有责任心和自我驱动力，能承受一定工作压力，沟通能力良好，有团队精神；6. 有良好的编程习惯和简洁清晰的代码风格，热爱技术，有极客精神，工作效率高；7. 熟悉php语言优先。",https://www.lagou.com/jobs/6450715.html,22.545769,113.945772,golang后端,8k-16k,"['后端', '服务器端', 'Linux/Unix']",高新园,深圳-南山区-大冲-科苑路讯美科技广场3号楼15C,1-3年
230,下午6点最活跃,深圳市本牛科技有限责任公司,50-150人,2019-10-25 10:11:56,南山区,本科,天使轮,"教育,硬件",职位描述：                我们需要你：1.负责服务端业务模块的开发2.持续优化项目的代码质量我们希望你：1.3年以上服务器端开发经验；2.对JavaScript、Node.js有较为系统的学习和了解，基础扎实3.熟悉 MongoDB、Redis 等 NoSQL 数据库4.至少看过一个中大型优秀开源项目源代码者优先5.对计算机基础有一定了解，如操作系统、算法知识等6.学习能力强，能够持续学习进步加分项：1.有自己的技术博客或者开源项目2.有其它后端开发语言开发经验我们提供你：别人裁员我们还在扩招的潜力超大的平台~自由讨论自由争吵只要你能说服别人就行的超包容环境~身体是革命的本钱，跑步打球都是我们的日常生活~当然不能缺送金 送银 送花 的丰厚奖金啦~！！我们是：本牛科技（benewtech）成立于2015年，是一家专注于儿童启蒙教育的互联网创业公司。基于互联网+，本牛科技构建了一个熏听启蒙教育平台，且创造性地推出国内一款专为儿童熏听启蒙而设计的智能硬件——牛听听。本牛科技是一个70后掌舵，80后挑大梁，90后为主力的创业团队，由来自早教、移动互联网和智能硬件行业的年轻精英组成。对儿童教育的热切关注使我们紧紧凝聚在一起，愿以我们的微薄之力，让经典的东西方文化通过日复一日的熏陶，浸润到儿童内心深处，慢慢生根发芽，成为其未来的力量之源！小伙伴快到碗里来啦！！~~,https://www.lagou.com/jobs/6026981.html,22.546157,113.946882,node.js后端,15k-30k,"['服务器端', '后端', 'Javascript', '客户端']",高新园,深圳-南山区-大冲-科技园北区科华路讯美科技广场1栋1101号,3-5年
231,下午5点最活跃,深圳市耀卓网络科技有限公司,50-150人,2019-10-25 10:03:24,南山区,大专,不需要融资,游戏,职位描述：                岗位职责：1、负责开发后台数据库相关服务；2、负责相关业务逻辑的后台实现；3、负责业务内容数据支持的开发。岗位要求：1、三年以上 node.js开发经验，精通 javascript 编程；2、了解Express/Pomelo等开源框架；3、对mysql，redis有实操经验，了解DB设计和优化；4、熟悉Node.js 常用模块，对系统架构设计，高性能和高并发有一定的经验可以搭建模拟后台；5、研究和试验新技术，并应用到产品中；6、熟悉HTTP协议，熟悉前后端的常见知识要点。弹性工作时间：9点、10点任意时间上班。,https://www.lagou.com/jobs/6142993.html,22.585843,113.96296,node.js后端工程师,15k-20k,"['后端', 'Node.js']",大学城,深圳-南山区-西丽-南山区民企科技园A栋3楼301,1-3年
232,早11点最活跃,深圳市彩虹云宝网络有限公司,50-150人,2019-10-25 17:22:12,福田区,本科,A轮,"移动互联网,企业服务","职位描述：                工作要求：1. 本科及以上学历，计算机相关专业，熟悉Scala/Java，1-3年Scala/Java开发经验；2. 熟悉主流框架的使用方法，包括Play Framework, Spring等；3. 熟悉MySQL等数据库设计和开发；4. 熟悉Redis、Memcache、Hbase等一种或多种NOSQL的设计和开发；5. 熟悉Nginx、Tengine、Varnish等一种或多种组件；6. 熟悉Linux，能使用包括Shell、Ruby、Python在内的一种或多种语言实现脚本；7. 了解前端开发技能，包括html、CSS、JavaScript，了解前端工程化，有Web页面调优的能力，熟悉前后端分离；8. 熟悉企业应用设计模式，面向对象的分析和设计技术，包括设计模式、UML建模等；9. 良好的英文读写能力，能无障碍的读写技术文档;10. 良好的沟通与表达能力，思路清晰，业务逻辑理解与分析能力强，能够独立解决遇到的各种问题，有强烈的责任心。",https://www.lagou.com/jobs/4278833.html,22.551303,114.047449,Scala后端开发工程师,10k-20k,['Scala'],梅景,深圳-福田区-景田-商报路2号奥林匹克大厦6GMHK,3-5年
233,下午6点最活跃,深圳无内科技有限公司,15-50人,2019-10-25 15:24:52,南山区,本科,未融资,信息安全,职位描述：                1. 负责公司项目与产品的需求分析、架构设计、技术决策、开发规范及核心代码实现；任职要求：1. 本科以上学历，5年以上研发经验2. 丰富的 go/python 项目开发经验，有完整项目负责经验；3. 熟悉Docker的相关开源技术，分析过Docker源码者优先；4. 熟悉各种软件开发模式，熟悉OKR等；5. 有运维或安全产品开发经验。,https://www.lagou.com/jobs/6474997.html,22.522776,113.936407,golang后端开发工程师（中高级）,25k-35k,['Golang'],南山,深圳-南山区-科技园-粤海街道滨海社区滨海大道3398号赛西科技大厦20层2003室,3-5年
234,下午3点最活跃,亿众骏达网络科技（深圳）有限公司,50-150人,2019-10-25 10:13:02,南山区,大专,A轮,"企业服务,电商",职位描述：                岗位职责1、负责友好速搭SaaS服务产品功能开发，基础技术迭代和日常系统维护，负责功能的方案设计和开发；2、参与产品需求的分析和技术实现方案，包括服务架构，API接口，数据库架构等多项基础指标；3、配合团队完成数据处理，查询，统计和分析等工作；4、参与团队项目开发的技术研究和创新。岗位要求1、有一年以上Ruby，Ruby on Rails，PHP，Java，Python等web开发经验，能独立开发中等规模Web应用；2、熟悉常用的数据库，缓存技术，如Postgres，Redis，MongoDB等；3、熟练使用Git/SVN等代码版本控制系统；4、能适应一定的工作压力，团队协作能力强；5、大专及以上学历，计算机相关专业。,https://www.lagou.com/jobs/5603022.html,22.553942,113.941651,Ruby后端研发工程师,8k-10k,"['后端', '平台', 'Ruby']",,深圳-南山区-科技园新西路7号兰光科技大厦B801,1-3年
235,早9点最活跃,深圳市智城时代科技有限公司,50-150人,2019-10-25 13:50:01,南山区,本科,不需要融资,"移动互联网,其他","职位描述：                岗位职责：1. 负责产品后台服务器功能需求分析，设计及开发；2. 参与服务器架构性能优化；3. 负责服务器代码部署、升级，数据维护。任职资格:1. 3年以上后端系统开发经验，至少一个大型项目开发经验2. 2年以上 Node.js 服务端开发经验, 精通 Nodejs API3. 精通 Javascript, 对其核心概念有深刻理解；精通 ES6+4. 至少精通一种 Nodejs 开发框架，如：Express, Koa2等5. 熟练使用Mysql,Redis,MongoDB等相关数据库6. 深入了解RESTful 设计原则和最佳实践，了解 GraphQL7. 熟悉 JavaScript 和 Node.js，熟练使用 Vue.js8. 熟悉 HTML5 和 CSS3；9. 熟悉 webpack、Grunt 或 gulp 等工具",https://www.lagou.com/jobs/6325979.html,22.548993,113.942632,Node.js 后端开发工程师,15k-25k,"['后端', 'C++', 'Javascript', 'Node.js']",深大,深圳-南山区-大冲-科兴科学园A4-602,3-5年
236,早9点最活跃,深圳映美卡莫网络有限公司,50-150人,2019-10-24 10:24:12,南山区,大专,不需要融资,"移动互联网,电商","职位描述：                岗位职责：1.从事公司云打印事业部产品的研发工作；2.根据开发规范与流程能独立按计划完成模块的设计、编码、自测及相关技术文档编写；3.对反馈的软件产品故障进行定位、跟踪、调试和修复；4.参与产品研发过程中的相关评审工作并提出评审意见；5.高级工程师负责后端技术架构搭建及重构、技术创新、项目管理；任职要求：1、3年及以上.NET平台实际项目开发经验，专科及以上学历，计算机或相关专业；2、理解.NET架构体系,精通C#/MVC/WebApi等开发语言及技术；3、精通MySql/SQL Server/Oracle等主流关系型数据库其中一种及具备SQL性能调优能力；；4、熟悉NoSQL存储（Redis、Mongodb）及Rabbit MQ等消息中间件；5、熟悉面向服务编程，熟悉常用的设计模式；6、逻辑思维清晰，有良好的编程风格及技术文档阅读能力；7、有强烈的团队意识和执行力、上进心和求知欲，善于学习和运用新知识，良好的沟通能力；8、有以下方面开发者优先：有中大型互联网服务架构、负载均衡设计经验；",https://www.lagou.com/jobs/4166921.html,22.536473,113.955136,.NET后端开发工程师,10k-17k,"['C#/.NET', '后端', '分布式']",高新园,深圳-南山区-科技南十二路九洲电器大厦708,3-5年
237,下午5点最活跃,深圳米趣玩科技有限公司,50-150人,2019-10-25 17:38:58,南山区,大专,不需要融资,游戏,职位描述：                岗位职责：1、负责服务器的架构搭建、功能研发；2、后端团队建设，带领服务器团队保质保量完成项目进度，帮助其他成员成长。任职要求：1、本科以上学历，5年以上游戏后台开发经验，其中Go语言有3年以上开发经验；2、有良好的逻辑思辨，具备快速分析和解决问题的能力；3、积极进取的价值观，和其他团队能够无缝接合；4、Golang开发经验丰富，对于语言的各种特性具有深入的认知；5、 熟悉网络编程框架，具备网络调优的能力；6、 熟练掌握多机通信框架，对服务器架构有自己的理解，能够搭建和维护服务器机群；7、熟练掌握Linux操作系统和Shell编程，能够快速修复服务器的各种异常和故障；8、 熟悉各种数据库的原理和使用，包括redis、mysql及分布式数据库等；9、熟悉异步和并发编程框架，释放服务器的多核潜力；10、强烈的责任心与危机意识，积极发现项目和团队的问题，防患风险于未然。,https://www.lagou.com/jobs/6321485.html,22.529351,113.952494,Go/Golang游戏服务器主程,20k-40k,"['Golang', 'GO', 'Linux/Unix']",高新园,深圳-南山区-大冲-深圳湾科技生态园10栋B座4楼A10,5-10年
238,早10点最活跃,深圳市维创通科技有限公司,15-50人,2019-10-25 19:44:11,南山区,本科,天使轮,"企业服务,物联网",职位描述：                技能要求J2EE  数据库  Java  中间件 算法有很强的代码编写能力，有一定的算法能力1、配合完成特定模块微服务框架、功能开发、接口开发、联调测试、应用部署和数据建表、数据库开发；2、梳理和优化后端基础架构和组件，常态化性能调优；要求：1、全日制本科或以上学历，计算机相关（物联网/软件工程）相关专业2、精通Java语言，3年左右Java后端开发经验，掌握JVM原理，对Java基础框架有深入了解3、精通数据库设计、分析、代码编写和调试，熟悉至少一种主流关系数据库架构产品，比如postgresql、oracle、sqlserver、mysql等4、精通主流开源Web框架（SpringBoot、SpringCloud等），熟悉常用的中间件技术（如缓存、消息队列、调度框架等）5、有很强的自我管理并且愿意融入到一个快速交付的工作环境,https://www.lagou.com/jobs/6420639.html,22.531747,113.930888,java后端工程师,12k-24k,"['中间件', 'J2EE', '分布式', '算法']",南山,深圳-南山区-桃园西海明珠大厦,3-5年
239,下午6点最活跃,广发证券股份有限公司,2000人以上,2019-10-25 09:40:56,南山区,本科,上市公司,金融,职位描述：                职责范围：1、参与核心系统架构设计，对整体产出负责2、跨团队和跨部门沟通，与多角色沟通，深刻理解教育业务3、追求**，完成技术架构设计和核心技术攻关等工作4、分析和发现系统的优化点，负责推动产品架构优化 岗位要求1、211以上本科及以上学历，5年左右后端开发经验2、负责过较高复杂度的业务后端或基础服务，有比较完整的经验3、扎实的编程基础，熟悉Java，并且熟悉其中一门其他语言，熟悉主流的存储（MySQL/Redis等）和微服务架构4、优秀的跨团队沟通能力，能够推进项目进度，将技术的价值最大化5、熟悉互联网后端基础技术，优秀的架构设计能力，熟悉微服务架构，有B端或中台经验优先6、在主流互联网公司或有证券行业相关工作经历优先7、对有事件驱动，流计算（spark/flink），微服务架构体系经验优先8、对计算机体系，数据库，网络通信有深入了解，对延时计算有相关优化经验优先。,https://www.lagou.com/jobs/6324616.html,22.51828,113.93697,java后端高级工程师,25k-45k,"['后端', 'Java']",后海,深圳-南山区-后海-中洲控股大厦,3-5年
240,早10点最活跃,腾讯科技（深圳）有限公司,2000人以上,2019-10-24 12:05:27,南山区,本科,上市公司,社交,职位描述：                【云市场产品后端研发】岗位职责：1. 负责腾讯云市场产品系统的后端研发和维护；2. 负责腾讯云市场产品相关功能的开发和迭代； 3. 负责腾讯云市场产品系统的架构规划、性能优化、稳定性优化等工作。岗位要求： 1. 熟练使用PHP、至少熟悉并使用过其中一种PHP开源框架（如：CI、Laravel、Lumen等）、有PHP项目的实战经验；2. 熟练使用mysql/redis/memcache等数据库，有mysql性能调优经验；3. 良好的理解沟通能力，合理进行任务分解，并以模块化的思维进行代码设计；4. 具有良好的代码风格、接口设计规范；5. 具有大型运营系统、整站开发经验者优先；6. 至少3年工作经验，本科及以上学历；7. 熟悉云计算、有云产品使用经验者优先。,https://www.lagou.com/jobs/6333974.html,22.540718,113.934464,云市场产品后端研发,30k-60k,"['后端', 'Laravel', '服务器端', 'Linux/Unix']",桃园,深圳-南山区-前海-腾讯大厦,5-10年
241,早11点最活跃,腾讯科技（深圳）有限公司,2000人以上,2019-10-24 18:56:48,南山区,本科,上市公司,社交,职位描述：                工作职责：－参与腾讯游戏数据平台元数据管理系统的开发；－参与腾讯游戏数据平台数据质量、数据流监控的开发；－参与腾讯游戏数据平台数据分析模块的开发。 岗位要求：－精通Python，3年以上Python后台开发经验，有良好的编码习惯；－熟悉Unix/Linux操作系统下的开发、部署、维护等工作；－精通Python服务端编程，精通网络编程；－熟悉大型分布式系统设计与开发，并有MQ、NoSQL实战经验；－有数据平台元数据管理、数据质量监控研发经验者优先；－有大数据分析/BI/OLAP后台系统研发经验者优先；－具备优秀的沟通能力、学习能力、分析解决问题能力；－具有高度的责任心和团队合作精神。,https://www.lagou.com/jobs/4835899.html,39.977196,116.336876,数据分析平台开发工程师（Python）,20k-40k,"['Python', '数据库']",,深圳-南山区-前海-腾讯大厦,3-5年
